word,ipa,cmu_pron,phoneme_set,polish_respellings,pos,frequency_rank,level,definition,example_sentence
lemon,l ɛ m ʌ n,L EH1 M AH0 N,"{l, m, n, ɛ, ʌ}",leman,"noun, verb",1642,unknown,"A yellow citrus fruit with a bitter, acidic juice",She added lemon to the tea.
lend,l ɛ n d,L EH1 N D,"{d, l, n, ɛ}",lend,"verb, noun",1643,unknown,Grant to (someone) the use of (something) on the understanding that it will be returned,Can you lend me your pen?
length,l ɛ ŋ k θ,L EH1 NG K TH,"{k, l, ŋ, ɛ, θ}",leŋkθ,"noun, verb",1644,unknown,The measurement or extent of something from end to end,The length of the table is 2 meters.
less,l ɛ s,L EH1 S,"{l, s, ɛ}",les,"adjective, adverb",1645,unknown,To a smaller extent; not as much,She earns less money than he does.
lesson,l ɛ s ʌ n,L EH1 S AH0 N,"{l, n, s, ɛ, ʌ}",lesan,"noun, verb",1646,unknown,An amount of teaching given at one time; a period of learning or teaching,The teacher gave a history lesson.
let,l ɛ t,L EH1 T,"{l, t, ɛ}",let,"verb, noun",1647,unknown,Allow someone to have or do something,She let him use her car.
letter,l ɛ t ɝ,L EH1 T ER0,"{l, t, ɛ, ɝ}",leter,"noun, verb",1648,unknown,"A written, typed, or printed communication, especially one sent in an envelope by mail or messenger",She received a letter from her friend.
level,l ɛ v ʌ l,L EH1 V AH0 L,"{l, v, ɛ, ʌ}",lewal,"noun, verb",1649,unknown,"A position on a real or imaginary scale of amount, quantity, extent, or quality",The water level is rising.
library,l aɪ b r ɛ r i,L AY1 B R EH0 R IY2,"{aɪ, b, i, l, r, ɛ}",lajbreri,"noun, verb",1650,unknown,"A building or room containing collections of books, periodicals, and sometimes films and recorded music for people to read, borrow, or refer to",She borrowed the book from the library.
license,l aɪ s ʌ n s,L AY1 S AH0 N S,"{aɪ, l, n, s, ʌ}",lajsans,"noun, verb",1651,unknown,"A permit from an authority to own or use something, do a particular thing, or carry on a trade (especially in alcoholic drinks)",He has a driver's license.
lie,l aɪ,L AY1,"{aɪ, l}",laj,"verb, noun",1652,unknown,Be in or assume a horizontal or resting position on a supporting surface,He lies down to rest every afternoon.
life,l aɪ f,L AY1 F,"{aɪ, f, l}",lajf,"noun, verb",1653,unknown,The existence of an individual human being or animal,Life is beautiful.
lift,l ɪ f t,L IH1 F T,"{f, l, t, ɪ}",lyft,"verb, noun",1654,unknown,Raise to a higher position or level,She can lift heavy weights.
light,l aɪ t,L AY1 T,"{aɪ, l, t}",lajt,"noun, verb",1655,unknown,The natural agent that stimulates sight and makes things visible,The room is filled with light.
lightly,l aɪ t l i,L AY1 T L IY0,"{aɪ, i, l, t}",lajtli,adverb,1656,unknown,"With little weight, force, intensity, etc.",She touched the fabric lightly.
like,l aɪ k,L AY1 K,"{aɪ, k, l}",lajk,"preposition, noun",1657,unknown,Having the same characteristics or qualities as; similar to,He likes to play soccer.
likely,l aɪ k l i,L AY1 K L IY0,"{aɪ, i, k, l}",lajkli,"adjective, adverb",1658,unknown,Such as well might happen or be true; probable,It is likely to rain tomorrow.
limit,l ɪ m ʌ t,L IH1 M AH0 T,"{l, m, t, ɪ, ʌ}",lymat,"noun, verb",1659,unknown,A point or level beyond which something does not or may not extend or pass,There is a limit to how much you can carry.
limited,l ɪ m ʌ t ʌ d,L IH1 M AH0 T AH0 D,"{d, l, m, t, ɪ, ʌ}",lymatad,"adjective, verb",1660,unknown,"Restricted in size, amount, or extent; few, small, or short",The tickets are limited in number.
line,l aɪ n,L AY1 N,"{aɪ, l, n}",lajn,"noun, verb",1661,unknown,"A long, narrow mark or band",Draw a straight line.
link,l ɪ ŋ k,L IH1 NG K,"{k, l, ŋ, ɪ}",lyŋk,"noun, verb",1662,unknown,"A relationship between two things or situations, especially where one thing affects the other",There is a direct link between smoking and lung cancer.
lip,l ɪ p,L IH1 P,"{l, p, ɪ}",lyp,"noun, verb",1663,unknown,Either of the two fleshy parts that form the upper and lower edges of the opening of the mouth,She applied lipstick to her lips.
liquid,l ɪ k w ʌ d,L IH1 K W AH0 D,"{d, k, l, w, ɪ, ʌ}",lykład,"noun, adjective",1664,unknown,"A substance that flows freely but is of constant volume, having a consistency like that of water or oil",Water is a liquid.
list,l ɪ s t,L IH1 S T,"{l, s, t, ɪ}",lyst,"noun, verb",1665,unknown,"A number of connected items or names written or printed consecutively, typically one below the other",Make a list of items you need.
listen,l ɪ s ʌ n,L IH1 S AH0 N,"{l, n, s, ɪ, ʌ}",lysan,"verb, noun",1666,unknown,Give one's attention to a sound,Listen to the teacher.
literature,l ɪ t ɝ ʌ tʃ ɝ,L IH1 T ER0 AH0 CH ER0,"{l, t, tʃ, ɝ, ɪ, ʌ}",lyteraćer,"noun, verb",1667,unknown,"Written works, especially those considered of superior or lasting artistic merit",She studies English literature.
little,l ɪ t ʌ l,L IH1 T AH0 L,"{l, t, ɪ, ʌ}",lytal,"adjective, noun",1668,unknown,"Small in size, amount, or degree",There is a little cat in the garden.
live,l aɪ v,L AY1 V,"{aɪ, l, v}",lajw,"verb, adjective",1669,unknown,Remain alive,Many animals live in the forest.
living,l ɪ v ɪ ŋ,L IH1 V IH0 NG,"{l, v, ŋ, ɪ}",lywyŋ,"noun, adjective",1670,unknown,An income sufficient to live on or the means of earning it,He is earning a living as a teacher.
load,l oʊ d,L OW1 D,"{d, l, oʊ}",lołd,"noun, verb",1671,unknown,A heavy or bulky thing that is being carried or is about to be carried,He carried a heavy load.
loan,l oʊ n,L OW1 N,"{l, n, oʊ}",lołn,"noun, verb",1672,unknown,"A thing that is borrowed, especially a sum of money that is expected to be paid back with interest",She took out a loan to buy a car.
local,l oʊ k ʌ l,L OW1 K AH0 L,"{k, l, oʊ, ʌ}",lołkal,"adjective, noun",1673,unknown,Relating or restricted to a particular area or one's neighborhood,She shops at the local market.
locate,l oʊ k eɪ t,L OW1 K EY2 T,"{eɪ, k, l, oʊ, t}",lołkejt,"verb, noun",1674,unknown,Discover the exact place or position of,They were able to locate the missing keys.
location,l oʊ k eɪ ʃ ʌ n,L OW0 K EY1 SH AH0 N,"{eɪ, k, l, n, oʊ, ʃ, ʌ}",lołkejśan,"noun, verb",1675,unknown,A particular place or position,The location of the building is ideal.
lock,l ɑ k,L AA1 K,"{k, l, ɑ}",lak,"noun, verb",1676,unknown,"A device for securing a door, gate, lid, or drawer in position when closed, typically operated by a key",He locked the door before leaving.
log,l ɔ g,L AO1 G,"{g, l, ɔ}",log,"noun, verb",1677,unknown,A part of the trunk or a large branch of a tree that has fallen or been cut off,He threw another log on the fire.
logic,l ɑ dʒ ɪ k,L AA1 JH IH0 K,"{dʒ, k, l, ɑ, ɪ}",ladżyk,"noun, verb",1678,unknown,Reasoning conducted or assessed according to strict principles of validity,His argument lacks logic.
logical,l ɑ dʒ ɪ k ʌ l,L AA1 JH IH0 K AH0 L,"{dʒ, k, l, ɑ, ɪ, ʌ}",ladżykal,"adjective, noun",1679,unknown,Of or according to the rules of logic or formal argument,She gave a logical explanation.
lonely,l oʊ n l i,L OW1 N L IY0,"{i, l, n, oʊ}",lołnli,"adjective, noun",1680,unknown,Sad because one has no friends or company,She felt lonely after moving to a new city.
long,l ɔ ŋ,L AO1 NG,"{l, ŋ, ɔ}",loŋ,"adjective, verb",1681,unknown,Measuring a great distance from end to end,They took a long walk.
look,l ʊ k,L UH1 K,"{k, l, ʊ}",luk,"verb, noun",1682,unknown,Direct one's gaze toward someone or something or in a specified direction,Look at the sky.
loose,l u s,L UW1 S,"{l, s, u}",lus,"adjective, noun",1683,unknown,Not firmly or tightly fixed in place; detached or able to be detached,The handle is loose.
lord,l ɔ r d,L AO1 R D,"{d, l, r, ɔ}",lord,"noun, verb",1684,unknown,"Someone or something having power, authority, or influence; a master or ruler",The lord of the manor lived in a grand house.
lose,l u z,L UW1 Z,"{l, u, z}",luz,"verb, noun",1685,unknown,Be deprived of or cease to have or retain (something),He tends to lose his keys.
loss,l ɔ s,L AO1 S,"{l, s, ɔ}",los,"noun, verb",1686,unknown,The fact or process of losing something or someone,The company suffered a loss last year.
lost,l ɔ s t,L AO1 S T,"{l, s, t, ɔ}",lost,"adjective, verb",1687,unknown,Unable to find one's way; not knowing one's whereabouts,He felt lost in the new city.
lot,l ɑ t,L AA1 T,"{l, t, ɑ}",lat,"noun, adverb",1688,unknown,"A particular group, collection, or set of people or things",She bought a lot of books.
loud,l aʊ d,L AW1 D,"{aʊ, d, l}",laud,"adjective, noun",1689,unknown,Producing or capable of producing much noise,The music was too loud.
loudly,l aʊ d l i,L AW1 D L IY0,"{aʊ, d, i, l}",laudli,adverb,1690,unknown,In a way that produces much noise,She spoke loudly.
love,l ʌ v,L AH1 V,"{l, v, ʌ}",law,"noun, verb",1691,unknown,An intense feeling of deep affection,They are deeply in love.
lovely,l ʌ v l i,L AH1 V L IY0,"{i, l, v, ʌ}",lawli,"adjective, noun",1692,unknown,Exquisitely beautiful,She has a lovely smile.
lover,l ʌ v ɝ,L AH1 V ER0,"{l, v, ɝ, ʌ}",lawer,"noun, verb",1693,unknown,A partner in a romantic or sexual relationship,He is her lover.
low,l oʊ,L OW1,"{l, oʊ}",loł,"adjective, noun",1694,unknown,Of less than average height from top to bottom or to the top from the ground,The table is too low.
lower,l oʊ ɝ,L OW1 ER0,"{l, oʊ, ɝ}",lołer,"verb, noun",1695,unknown,Move (someone or something) in a downward direction,Please lower your voice.
luck,l ʌ k,L AH1 K,"{k, l, ʌ}",lak,"noun, verb",1696,unknown,Success or failure apparently brought by chance rather than through one's own actions,He wished her good luck.
lucky,l ʌ k i,L AH1 K IY0,"{i, k, l, ʌ}",laki,"adjective, verb",1697,unknown,"Having, bringing, or resulting from good luck",He is a lucky person.
luggage,l ʌ g ʌ dʒ,L AH1 G AH0 JH,"{dʒ, g, l, ʌ}",lagadż,"noun, adjective",1698,unknown,Suitcases or other bags in which to pack personal belongings for traveling,They carried their luggage to the car.
lump,l ʌ m p,L AH1 M P,"{l, m, p, ʌ}",lamp,"noun, verb",1699,unknown,"A compact mass of a substance, especially one without a definite or regular shape",He found a lump in the soup.
lunch,l ʌ n tʃ,L AH1 N CH,"{l, n, tʃ, ʌ}",lanć,"noun, verb",1700,unknown,"A meal eaten in the middle of the day, typically one that is lighter or less formal than an evening meal",We have lunch at noon.
lung,l ʌ ŋ,L AH1 NG,"{l, ŋ, ʌ}",laŋ,"noun, verb",1701,unknown,"Each of the pair of organs situated within the ribcage, responsible for breathing",Smoking is harmful to the lungs.
machine,m ʌ ʃ i n,M AH0 SH IY1 N,"{i, m, n, ʃ, ʌ}",maśin,"noun, verb",1702,unknown,"An apparatus using or applying mechanical power and having several parts, each with a definite function and together performing a particular task",The washing machine is broken.
machinery,m ʌ ʃ i n ɝ i,M AH0 SH IY1 N ER0 IY0,"{i, m, n, ɝ, ʃ, ʌ}",maśineri,"noun, verb",1703,unknown,Machines collectively,The factory uses advanced machinery.
mad,m æ d,M AE1 D,"{d, m, æ}",med,"adjective, noun",1704,unknown,Very angry,She was mad at him.
magazine,m æ g ʌ z i n,M AE1 G AH0 Z IY2 N,"{g, i, m, n, z, æ, ʌ}",megazin,"noun, verb",1705,unknown,"A periodical publication containing articles and illustrations, typically covering a particular subject or area of interest",She read a fashion magazine.
magic,m æ dʒ ɪ k,M AE1 JH IH0 K,"{dʒ, k, m, æ, ɪ}",medżyk,"noun, adjective",1706,unknown,The power of apparently influencing events by using mysterious or supernatural forces,He believes in magic.
mail,m eɪ l,M EY1 L,"{eɪ, l, m}",mejl,"noun, verb",1707,unknown,Letters and packages conveyed by the postal system,She received mail from her friend.
main,m eɪ n,M EY1 N,"{eɪ, m, n}",mejn,"adjective, noun",1708,unknown,Chief in size or importance,The main road is closed.
mainly,m eɪ n l i,M EY1 N L IY0,"{eɪ, i, l, m, n}",mejnli,adverb,1709,unknown,For the most part; chiefly,He is mainly interested in sports.
maintain,m eɪ n t eɪ n,M EY0 N T EY1 N,"{eɪ, m, n, t}",mejntejn,"verb, noun",1710,unknown,Cause or enable (a condition or situation) to continue,They maintain their car well.
major,m eɪ dʒ ɝ,M EY1 JH ER0,"{dʒ, eɪ, m, ɝ}",mejdżer,"adjective, noun",1711,unknown,"Important, serious, or significant",He played a major role in the project.
majority,m ʌ dʒ ɔ r ʌ t i,M AH0 JH AO1 R AH0 T IY0,"{dʒ, i, m, r, t, ɔ, ʌ}",madżorati,"noun, verb",1712,unknown,The greater number,The majority of people agree.
make,m eɪ k,M EY1 K,"{eɪ, k, m}",mejk,"verb, noun",1713,unknown,Form (something) by putting parts together or combining substances; construct; create,She likes to make cakes.
male,m eɪ l,M EY1 L,"{eɪ, l, m}",mejl,"adjective, noun",1714,unknown,Relating to men or boys,There is a male lion in the zoo.
mall,m ɔ l,M AO1 L,"{l, m, ɔ}",mol,"noun, verb",1715,unknown,A large enclosed shopping area from which traffic is excluded,They went to the mall to shop.
man,m æ n,M AE1 N,"{m, n, æ}",men,"noun, verb",1716,unknown,An adult human male,He is a strong man.
manage,m æ n ʌ dʒ,M AE1 N AH0 JH,"{dʒ, m, n, æ, ʌ}",menadż,"verb, noun",1717,unknown,"Be in charge of (a company, establishment, or undertaking); administer; run",She manages the store.
management,m æ n ʌ dʒ m ʌ n t,M AE1 N AH0 JH M AH0 N T,"{dʒ, m, n, t, æ, ʌ}",menadżmant,"noun, verb",1718,unknown,The process of dealing with or controlling things or people,Effective management is crucial.
manager,m æ n ʌ dʒ ɝ,M AE1 N AH0 JH ER0,"{dʒ, m, n, æ, ɝ, ʌ}",menadżer,"noun, verb",1719,unknown,A person responsible for controlling or administering an organization or group of staff,He is the manager of the team.
manner,m æ n ɝ,M AE1 N ER0,"{m, n, æ, ɝ}",mener,"noun, verb",1720,unknown,A way in which a thing is done or happens,She spoke in a friendly manner.
manufacture,m æ n j ʌ f æ k tʃ ɝ,M AE2 N Y AH0 F AE1 K CH ER0,"{f, j, k, m, n, tʃ, æ, ɝ, ʌ}",menjafekćer,"verb, noun",1721,unknown,Make (something) on a large scale using machinery,The company manufactures cars.
manufacturer,m æ n j ʌ f æ k tʃ ɝ ɝ,M AE2 N Y AH0 F AE1 K CH ER0 ER0,"{f, j, k, m, n, tʃ, æ, ɝ, ʌ}",menjafekćerer,"noun, verb",1722,unknown,A person or company that makes goods for sale,The manufacturer issued a recall.
many,m ɛ n i,M EH1 N IY0,"{i, m, n, ɛ}",meni,"adjective, pronoun",1723,unknown,A large number of,There are many options.
map,m æ p,M AE1 P,"{m, p, æ}",mep,"noun, verb",1724,unknown,"A diagrammatic representation of an area of land or sea showing physical features, cities, roads, etc.",She looked at the map.
march,m ɑ r tʃ,M AA1 R CH,"{m, r, tʃ, ɑ}",marć,"noun, proper noun",1725,unknown,"The third month of the year, in the northern hemisphere usually considered the first month of spring",March is a windy month.
mark,m ɑ r k,M AA1 R K,"{k, m, r, ɑ}",mark,"noun, verb",1726,unknown,Make a visible impression or stain on,He marked the spot on the map.
market,m ɑ r k ʌ t,M AA1 R K AH0 T,"{k, m, r, t, ɑ, ʌ}",markat,"noun, verb",1727,unknown,"A regular gathering of people for the purchase and sale of provisions, livestock, and other commodities",She went to the market to buy vegetables.
marketing,m ɑ r k ʌ t ɪ ŋ,M AA1 R K AH0 T IH0 NG,"{k, m, r, t, ŋ, ɑ, ɪ, ʌ}",markatyŋ,"noun, verb",1728,unknown,"The action or business of promoting and selling products or services, including market research and advertising",He works in marketing.
marriage,m ɛ r ɪ dʒ,M EH1 R IH0 JH,"{dʒ, m, r, ɛ, ɪ}",merydż,"noun, verb",1729,unknown,The legally or formally recognized union of two people as partners in a personal relationship,Their marriage ceremony was beautiful.
married,m ɛ r i d,M EH1 R IY0 D,"{d, i, m, r, ɛ}",merid,"adjective, verb",1730,unknown,Having a spouse,They are happily married.
marry,m ɛ r i,M EH1 R IY0,"{i, m, r, ɛ}",meri,"verb, noun",1731,unknown,Join in marriage,They plan to marry next year.
mass,m æ s,M AE1 S,"{m, s, æ}",mes,"noun, verb",1732,unknown,A large body of matter with no definite shape,The planet has a large mass.
massive,m æ s ɪ v,M AE1 S IH0 V,"{m, s, v, æ, ɪ}",mesyw,"adjective, noun",1733,unknown,Large and heavy or solid,The building is massive.
master,m æ s t ɝ,M AE1 S T ER0,"{m, s, t, æ, ɝ}",mester,"noun, verb",1734,unknown,Having or showing very great skill or proficiency,She is a master at chess.
match,m æ tʃ,M AE1 CH,"{m, tʃ, æ}",meć,"noun, verb",1735,unknown,A person or thing that is equal to another in quality or strength,The curtains are a perfect match for the sofa.
matching,m æ tʃ ɪ ŋ,M AE1 CH IH0 NG,"{m, tʃ, æ, ŋ, ɪ}",mećyŋ,"adjective, verb",1736,unknown,"Corresponding in pattern, color, or design; complementary",They are wearing matching outfits.
mate,m eɪ t,M EY1 T,"{eɪ, m, t}",mejt,"noun, verb",1737,unknown,Each of a pair of birds or other animals that breed together,Birds find a mate during the breeding season.
material,m ʌ t ɪ r i ʌ l,M AH0 T IH1 R IY0 AH0 L,"{i, l, m, r, t, ɪ, ʌ}",matyrial,"noun, adjective",1738,unknown,The matter from which a thing is or can be made,The dress is made of a soft material.
mathematics,m æ θ ʌ m æ t ɪ k s,M AE2 TH AH0 M AE1 T IH0 K S,"{k, m, s, t, æ, ɪ, ʌ, θ}",meθametyks,"noun, verb",1739,unknown,"The abstract science of number, quantity, and space",He is good at mathematics.
matter,m æ t ɝ,M AE1 T ER0,"{m, t, æ, ɝ}",meter,"noun, verb",1740,unknown,The substance or substances of which any physical object consists or is composed,Dark matter makes up most of the universe.
maximum,m æ k s ʌ m ʌ m,M AE1 K S AH0 M AH0 M,"{k, m, s, æ, ʌ}",meksamam,"noun, adjective",1741,unknown,"As great, high, or intense as possible or permitted",She reached the maximum score.
may,m eɪ,M EY1,"{eɪ, m}",mej,"verb, noun",1742,unknown,Expressing possibility,May I come in?
maybe,m eɪ b i,M EY1 B IY0,"{b, eɪ, i, m}",mejbi,adverb,1743,unknown,Perhaps; possibly,Maybe we should try a different approach.
mayor,m eɪ ɝ,M EY1 ER0,"{eɪ, m, ɝ}",mejer,"noun, verb",1744,unknown,"The elected head of a city, town, or other municipality",The mayor attended the event.
me,m i,M IY1,"{i, m}",mi,pronoun,1745,unknown,Used by a speaker to refer to himself or herself as the object of a verb or preposition,She gave me a gift.
meal,m i l,M IY1 L,"{i, l, m}",mil,"noun, verb",1746,unknown,"An occasion when food is eaten, or the food that is eaten on such an occasion",We had a delicious meal.
mean,m i n,M IY1 N,"{i, m, n}",min,"verb, noun",1747,unknown,"Intend to convey, indicate, or refer to (a particular thing or notion); signify",What do you mean?
meaning,m i n ɪ ŋ,M IY1 N IH0 NG,"{i, m, n, ŋ, ɪ}",minyŋ,"noun, verb",1748,unknown,"What is meant by a word, text, concept, or action",The meaning of the word is clear.
means,m i n z,M IY1 N Z,"{i, m, n, z}",minz,"noun, verb",1749,unknown,An action or system by which a result is achieved; a method,He found a means to achieve his goal.
meanwhile,m i n w aɪ l,M IY1 N W AY2 L,"{aɪ, i, l, m, n, w}",minłajl,adverb,1750,unknown,In the intervening period of time,"Meanwhile, she continued to work."
measure,m ɛ ʒ ɝ,M EH1 ZH ER0,"{m, ɛ, ɝ, ʒ}",meżer,"verb, noun",1751,unknown,"Ascertain the size, amount, or degree of (something) by using an instrument or device marked in standard units",Can you measure the length of this table?
measurement,m ɛ ʒ ɝ m ʌ n t,M EH1 ZH ER0 M AH0 N T,"{m, n, t, ɛ, ɝ, ʌ, ʒ}",meżermant,"noun, verb",1752,unknown,The action of measuring something,The measurement was accurate.
meat,m i t,M IY1 T,"{i, m, t}",mit,"noun, verb",1753,unknown,The flesh of an animal (especially a mammal) as food,They eat meat every day.
mechanic,m ʌ k æ n ɪ k,M AH0 K AE1 N IH0 K,"{k, m, n, æ, ɪ, ʌ}",makenyk,"noun, verb",1754,unknown,A person who repairs and maintains machinery,The car mechanic fixed the engine.
mechanical,m ʌ k æ n ɪ k ʌ l,M AH0 K AE1 N IH0 K AH0 L,"{k, l, m, n, æ, ɪ, ʌ}",makenykal,"adjective, noun",1755,unknown,Relating to or operated by machinery,The door is operated by a mechanical system.
media,m i d i ʌ,M IY1 D IY0 AH0,"{d, i, m, ʌ}",midia,"noun, verb",1756,unknown,"The main means of mass communication (broadcasting, publishing, and the internet) regarded collectively",The news was reported by the media.
medical,m ɛ d ʌ k ʌ l,M EH1 D AH0 K AH0 L,"{d, k, l, m, ɛ, ʌ}",medakal,"adjective, noun",1757,unknown,"Relating to the science of medicine, or to the treatment of illness and injuries",She is studying medical science.
medicine,m ɛ d ʌ s ʌ n,M EH1 D AH0 S AH0 N,"{d, m, n, s, ɛ, ʌ}",medasan,"noun, verb",1758,unknown,"The science or practice of the diagnosis, treatment, and prevention of disease (in technical use often taken to exclude surgery)",He takes medicine for his allergies.
medium,m i d i ʌ m,M IY1 D IY0 AH0 M,"{d, i, m, ʌ}",midiam,"noun, adjective",1759,unknown,An agency or means of doing something,The internet is a medium for communication.
meet,m i t,M IY1 T,"{i, m, t}",mit,"verb, noun",1760,unknown,Come into the presence or company of (someone) by chance or arrangement,Let's meet at the cafe.
meeting,m i t ɪ ŋ,M IY1 T IH0 NG,"{i, m, t, ŋ, ɪ}",mityŋ,"noun, verb",1761,unknown,"An assembly of people for a particular purpose, especially for formal discussion",The meeting will start at 10 AM.
melt,m ɛ l t,M EH1 L T,"{l, m, t, ɛ}",melt,"verb, noun",1762,unknown,Make or become liquefied by heat,The ice will melt in the sun.
member,m ɛ m b ɝ,M EH1 M B ER0,"{b, m, ɛ, ɝ}",member,"noun, verb",1763,unknown,An individual belonging to a group such as a society or team,He is a member of the club.
membership,m ɛ m b ɝ ʃ ɪ p,M EH1 M B ER0 SH IH2 P,"{b, m, p, ɛ, ɝ, ɪ, ʃ}",memberśyp,"noun, verb",1764,unknown,The state of being a member of a particular group,She applied for membership.
memory,m ɛ m ɝ i,M EH1 M ER0 IY0,"{i, m, ɛ, ɝ}",memeri,"noun, verb",1765,unknown,The faculty by which the mind stores and remembers information,Her memory is excellent.
mental,m ɛ n t ʌ l,M EH1 N T AH0 L,"{l, m, n, t, ɛ, ʌ}",mental,"adjective, noun",1766,unknown,Relating to the mind,She has a strong mental capacity.
mention,m ɛ n ʃ ʌ n,M EH1 N SH AH0 N,"{m, n, ɛ, ʃ, ʌ}",menśan,"verb, noun",1767,unknown,Refer to something briefly and without going into detail,She didn't mention the meeting.
menu,m ɛ n j u,M EH1 N Y UW0,"{j, m, n, u, ɛ}",menju,"noun, verb",1768,unknown,A list of dishes available in a restaurant,The menu offers a variety of options.
mere,m ɪ r,M IH1 R,"{m, r, ɪ}",myr,"adjective, noun",1769,unknown,Used to emphasize how small or insignificant someone or something is,It was a mere coincidence.
merely,m ɪ r l i,M IH1 R L IY0,"{i, l, m, r, ɪ}",myrli,adverb,1770,unknown,Just; only,He was merely a child.
mess,m ɛ s,M EH1 S,"{m, s, ɛ}",mes,"noun, verb",1771,unknown,A dirty or untidy state of things or of a place,The room was in a mess.
message,m ɛ s ʌ dʒ,M EH1 S AH0 JH,"{dʒ, m, s, ɛ, ʌ}",mesadż,"noun, verb",1772,unknown,"A verbal, written, or recorded communication sent to or left for a recipient who cannot be contacted directly",He left a message on her voicemail.
metal,m ɛ t ʌ l,M EH1 T AH0 L,"{l, m, t, ɛ, ʌ}",metal,"noun, adjective",1773,unknown,"A solid material that is typically hard, shiny, malleable, fusible, and ductile, with good electrical and thermal conductivity",The sculpture was made of metal.
method,m ɛ θ ʌ d,M EH1 TH AH0 D,"{d, m, ɛ, ʌ, θ}",meθad,"noun, verb",1774,unknown,"A particular form of procedure for accomplishing or approaching something, especially a systematic or established one",The scientific method is crucial.
meter,m i t ɝ,M IY1 T ER0,"{i, m, t, ɝ}",miter,"noun, verb",1775,unknown,"The fundamental unit of length in the metric system, equal to 100 centimeters or approximately 39.37 inches",The room is five meters wide.
middle,m ɪ d ʌ l,M IH1 D AH0 L,"{d, l, m, ɪ, ʌ}",mydal,"noun, adjective",1776,unknown,"The point or position at an equal distance from the sides, edges, or ends of something",She stood in the middle of the room.
midnight,m ɪ d n aɪ t,M IH1 D N AY2 T,"{aɪ, d, m, n, t, ɪ}",mydnajt,"noun, adjective",1777,unknown,Twelve o'clock at night,The clock struck midnight.
might,m aɪ t,M AY1 T,"{aɪ, m, t}",majt,"verb, noun",1778,unknown,Past tense of may; used to express possibility or make a suggestion,He might come to the party.
mild,m aɪ l d,M AY1 L D,"{aɪ, d, l, m}",majld,"adjective, noun",1779,unknown,"Not severe, serious, or harsh",The weather is mild today.
mile,m aɪ l,M AY1 L,"{aɪ, l, m}",majl,"noun, verb",1780,unknown,"A unit of linear measure equal to 1,760 yards (approximately 1.609 kilometers)",They walked a mile to the store.
military,m ɪ l ʌ t ɛ r i,M IH1 L AH0 T EH2 R IY0,"{i, l, m, r, t, ɛ, ɪ, ʌ}",mylateri,"adjective, noun",1781,unknown,Relating to or characteristic of soldiers or armed forces,He is in the military.
milk,m ɪ l k,M IH1 L K,"{k, l, m, ɪ}",mylk,"noun, verb",1782,unknown,"An opaque white fluid rich in fat and protein, secreted by female mammals for the nourishment of their young",She drank a glass of milk.
milligram,m ɪ l ʌ g r æ m,M IH1 L AH0 G R AE2 M,"{g, l, m, r, æ, ɪ, ʌ}",mylagrem,"noun, adjective",1783,unknown,A unit of mass equal to one thousandth of a gram,The dosage is 500 milligrams.
millimetre,m ɪ l ʌ m i t ɝ,M IH1 L AH0 M IY2 T ER0,"{i, l, m, t, ɝ, ɪ, ʌ}",mylamiter,"noun, adjective",1784,unknown,A unit of length equal to one thousandth of a meter,The insect is only a few millimetres long.
million,m ɪ l j ʌ n,M IH1 L Y AH0 N,"{j, l, m, n, ɪ, ʌ}",myljan,"noun, adjective",1785,unknown,"The number equivalent to the product of a thousand and a thousand; 1,000,000",The population is over a million.
