word,ipa,cmu_pron,phoneme_set,polish_respellings,pos,frequency_rank,level,definition,example_sentence
abandon,ʌ b æ n d ʌ n,AH0 B AE1 N D AH0 N,"{b, d, n, æ, ʌ}",abendan,verb,1,unknown,Cease to support or look after (someone); desert,She decided to abandon her plans.
abandoned,ʌ b æ n d ʌ n d,AH0 B AE1 N D AH0 N D,"{b, d, n, æ, ʌ}",abendand,adjective,2,unknown,Having been deserted or left,The house was abandoned.
ability,ʌ b ɪ l ʌ t i,AH0 B IH1 L AH0 T IY2,"{b, i, l, t, ɪ, ʌ}",abylati,noun,3,unknown,Possession of the means or skill to do something,She has the ability to learn languages quickly.
able,eɪ b ʌ l,EY1 B AH0 L,"{b, eɪ, l, ʌ}",ejbal,adjective,4,unknown,"Having the power, skill, means, or opportunity to do something",She is able to solve the problem.
about,ʌ b aʊ t,AH0 B AW1 T,"{aʊ, b, t, ʌ}",abaut,preposition,5,unknown,On the subject of; concerning,They talked about the project.
above,ʌ b ʌ v,AH0 B AH1 V,"{b, v, ʌ}",abaw,"preposition, adverb",6,unknown,At a higher level or layer,The birds flew above the trees.
abroad,ʌ b r ɔ d,AH0 B R AO1 D,"{b, d, r, ɔ, ʌ}",abrod,adverb,7,unknown,In or to a foreign country or countries,She studied abroad for a year.
absence,æ b s ʌ n s,AE1 B S AH0 N S,"{b, n, s, æ, ʌ}",ebsans,noun,8,unknown,The state of being away from a place or person,Her absence was noticed.
absent,æ b s ʌ n t,AE1 B S AH0 N T,"{b, n, s, t, æ, ʌ}",ebsant,adjective,9,unknown,"Not present in a place, at an occasion, or as part of something",He was absent from the meeting.
absolute,æ b s ʌ l u t,AE1 B S AH0 L UW2 T,"{b, l, s, t, u, æ, ʌ}",ebsalut,adjective,10,unknown,Not qualified or diminished in any way; total,There is absolute silence in the room.
absolutely,æ b s ʌ l u t l i,AE2 B S AH0 L UW1 T L IY0,"{b, i, l, s, t, u, æ, ʌ}",ebsalutli,adverb,11,unknown,"With no qualification, restriction, or limitation; totally",She is absolutely certain.
absorb,ʌ b z ɔ r b,AH0 B Z AO1 R B,"{b, r, z, ɔ, ʌ}",abzorb,verb,12,unknown,"Take in or soak up (energy, or a liquid or other substance) by chemical or physical action",The sponge absorbs water.
abuse,ʌ b j u s,AH0 B Y UW1 S,"{b, j, s, u, ʌ}",abjus,"noun, verb",13,unknown,Use (something) to bad effect or for a bad purpose; misuse,He was accused of abuse.
academic,æ k ʌ d ɛ m ɪ k,AE2 K AH0 D EH1 M IH0 K,"{d, k, m, æ, ɛ, ɪ, ʌ}",ekademyk,"adjective, noun",14,unknown,Relating to education and scholarship,She received academic awards.
accent,ʌ k s ɛ n t,AH0 K S EH1 N T,"{k, n, s, t, ɛ, ʌ}",aksent,"noun, verb",15,unknown,"A distinctive mode of pronunciation of a language, especially one associated with a particular nation, locality, or social class",He spoke with a British accent.
accept,æ k s ɛ p t,AE0 K S EH1 P T,"{k, p, s, t, æ, ɛ}",eksept,verb,16,unknown,Consent to receive or undertake (something offered),She accepted the job offer.
acceptable,æ k s ɛ p t ʌ b ʌ l,AE0 K S EH1 P T AH0 B AH0 L,"{b, k, l, p, s, t, æ, ɛ, ʌ}",ekseptabal,adjective,17,unknown,Able to be agreed on; suitable,The proposal is acceptable.
access,æ k s ɛ s,AE1 K S EH2 S,"{k, s, æ, ɛ}",ekses,"noun, verb",18,unknown,A means of approaching or entering a place,She has access to the library.
accident,æ k s ʌ d ʌ n t,AE1 K S AH0 D AH0 N T,"{d, k, n, s, t, æ, ʌ}",eksadant,noun,19,unknown,"An unfortunate incident that happens unexpectedly and unintentionally, typically resulting in damage or injury",She was injured in a car accident.
accidental,æ k s ʌ d ɛ n t ʌ l,AE2 K S AH0 D EH1 N T AH0 L,"{d, k, l, n, s, t, æ, ɛ, ʌ}",eksadental,"adjective, noun",20,unknown,"Happening by chance, unintentionally, or unexpectedly",It was an accidental discovery.
accidentally,æ k s ʌ d ɛ n t ʌ l i,AE2 K S AH0 D EH1 N T AH0 L IY0,"{d, i, k, l, n, s, t, æ, ɛ, ʌ}",eksadentali,adverb,21,unknown,By chance; in a way that was not planned or intended,She accidentally spilled the milk.
accommodation,ʌ k ɑ m ʌ d eɪ ʃ ʌ n,AH0 K AA2 M AH0 D EY1 SH AH0 N,"{d, eɪ, k, m, n, ɑ, ʃ, ʌ}",akamadejśan,noun,22,unknown,"A room, group of rooms, or building in which someone may live or stay",She found accommodation at a hotel.
accompany,ʌ k ʌ m p ʌ n i,AH0 K AH1 M P AH0 N IY0,"{i, k, m, n, p, ʌ}",akampani,verb,23,unknown,Go somewhere with (someone) as a companion or escort,She will accompany him on the trip.
account,ʌ k aʊ n t,AH0 K AW1 N T,"{aʊ, k, n, t, ʌ}",akaunt,"noun, verb",24,unknown,A report or description of an event or experience,She gave an account of the event.
accurate,æ k j ɝ ʌ t,AE1 K Y ER0 AH0 T,"{j, k, t, æ, ɝ, ʌ}",ekjerat,adjective,25,unknown,Correct in all details; exact,She provided an accurate report.
accurately,æ k j ɝ ʌ t l i,AE1 K Y ER0 AH0 T L IY0,"{i, j, k, l, t, æ, ɝ, ʌ}",ekjeratli,adverb,26,unknown,In a way that is correct in all details; exactly,The data was accurately recorded.
accuse,ʌ k j u z,AH0 K Y UW1 Z,"{j, k, u, z, ʌ}",akjuz,verb,27,unknown,Charge (someone) with an offense or crime,He was accused of theft.
achieve,ʌ tʃ i v,AH0 CH IY1 V,"{i, tʃ, v, ʌ}",aćiw,verb,28,unknown,"Successfully reach (a desired objective or result) by effort, skill, or courage",She achieved her goal.
achievement,ʌ tʃ i v m ʌ n t,AH0 CH IY1 V M AH0 N T,"{i, m, n, t, tʃ, v, ʌ}",aćiwmant,noun,29,unknown,"A thing done successfully, typically by effort, courage, or skill",She celebrated her achievement.
acid,æ s ʌ d,AE1 S AH0 D,"{d, s, æ, ʌ}",esad,"noun, adjective",30,unknown,"A chemical substance that neutralizes alkalis, dissolves some metals, and turns litmus red; typically, a corrosive or sour-tasting liquid of this kind",The acid burned his skin.
acknowledge,æ k n ɑ l ɪ dʒ,AE0 K N AA1 L IH0 JH,"{dʒ, k, l, n, æ, ɑ, ɪ}",eknalydż,verb,31,unknown,Accept or admit the existence or truth of,She acknowledged the problem.
acquire,ʌ k w aɪ ɝ,AH0 K W AY1 ER0,"{aɪ, k, w, ɝ, ʌ}",akłajer,verb,32,unknown,Buy or obtain (an asset or object) for oneself,She acquired new skills.
across,ʌ k r ɔ s,AH0 K R AO1 S,"{k, r, s, ɔ, ʌ}",akros,"preposition, adverb",33,unknown,"From one side to the other of (a place, area, etc.)",She walked across the street.
act,æ k t,AE1 K T,"{k, t, æ}",ekt,"verb, noun",34,unknown,Take action; do something,She decided to act.
action,æ k ʃ ʌ n,AE1 K SH AH0 N,"{k, n, æ, ʃ, ʌ}",ekśan,noun,35,unknown,"The fact or process of doing something, typically to achieve an aim",She took action to improve her grades.
active,æ k t ɪ v,AE1 K T IH0 V,"{k, t, v, æ, ɪ}",ektyw,adjective,36,unknown,Engaging or ready to engage in physically energetic pursuits,She is an active member of the community.
actively,æ k t ɪ v l i,AE1 K T IH0 V L IY0,"{i, k, l, t, v, æ, ɪ}",ektywli,adverb,37,unknown,In an active manner; energetically,She is actively involved in the project.
activity,æ k t ɪ v ʌ t i,AE0 K T IH1 V AH0 T IY0,"{i, k, t, v, æ, ɪ, ʌ}",ektywati,noun,38,unknown,The condition in which things are happening or being done,She enjoys outdoor activities.
actor,æ k t ɝ,AE1 K T ER0,"{k, t, æ, ɝ}",ekter,noun,39,unknown,"A person whose profession is acting on the stage, in movies, or on television",He is a famous actor.
actress,æ k t r ʌ s,AE1 K T R AH0 S,"{k, r, s, t, æ, ʌ}",ektras,noun,40,unknown,A female actor,She won an award for best actress.
actual,æ k tʃ ʌ w ʌ l,AE1 K CH AH0 W AH0 L,"{k, l, tʃ, w, æ, ʌ}",ekćałal,adjective,41,unknown,Existing in fact; real,This is the actual cost.
actually,æ k tʃ u ʌ l i,AE1 K CH UW2 AH0 L IY0,"{i, k, l, tʃ, u, æ, ʌ}",ekćuali,adverb,42,unknown,As the truth or facts of a situation; really,She actually likes the idea.
ad,æ d,AE1 D,"{d, æ}",ed,noun,43,unknown,An advertisement,She saw an ad in the newspaper.
adapt,ʌ d æ p t,AH0 D AE1 P T,"{d, p, t, æ, ʌ}",adept,verb,44,unknown,Make (something) suitable for a new use or purpose; modify,She adapted the recipe for her diet.
add,æ d,AE1 D,"{d, æ}",ed,verb,45,unknown,"Join (something) to something else so as to increase the size, number, or amount",She added sugar to the tea.
addition,ʌ d ɪ ʃ ʌ n,AH0 D IH1 SH AH0 N,"{d, n, ɪ, ʃ, ʌ}",adyśan,noun,46,unknown,The action or process of adding something to something else,"In addition to the main course, there were desserts."
additional,ʌ d ɪ ʃ ʌ n ʌ l,AH0 D IH1 SH AH0 N AH0 L,"{d, l, n, ɪ, ʃ, ʌ}",adyśanal,adjective,47,unknown,"Added, extra, or supplementary to what is already present or available",She requested additional information.
address,æ d r ɛ s,AE1 D R EH2 S,"{d, r, s, æ, ɛ}",edres,"noun, verb",48,unknown,The particulars of the place where someone lives or an organization is situated,She wrote her address on the form.
adequate,æ d ʌ k w ʌ t,AE1 D AH0 K W AH0 T,"{d, k, t, w, æ, ʌ}",edakłat,adjective,49,unknown,Satisfactory or acceptable in quality or quantity,She has adequate resources.
adequately,æ d ʌ k w ʌ t l i,AE1 D AH0 K W AH0 T L IY0,"{d, i, k, l, t, w, æ, ʌ}",edakłatli,adverb,50,unknown,In a satisfactory way,The task was adequately completed.
adjust,ʌ dʒ ʌ s t,AH0 JH AH1 S T,"{dʒ, s, t, ʌ}",adżast,verb,51,unknown,"Alter or move (something) slightly in order to achieve the desired fit, appearance, or result",She adjusted the mirror.
admiration,æ d m ɝ eɪ ʃ ʌ n,AE2 D M ER0 EY1 SH AH0 N,"{d, eɪ, m, n, æ, ɝ, ʃ, ʌ}",edmerejśan,noun,52,unknown,Respect and warm approval,She felt admiration for the artist.
admire,æ d m aɪ r,AE0 D M AY1 R,"{aɪ, d, m, r, æ}",edmajr,verb,53,unknown,"Regard (an object, quality, or person) with respect or warm approval",She admires her teacher.
admit,ʌ d m ɪ t,AH0 D M IH1 T,"{d, m, t, ɪ, ʌ}",admyt,verb,54,unknown,"Confess to be true or to be the case, typically with reluctance",She admitted her mistake.
adopt,ʌ d ɑ p t,AH0 D AA1 P T,"{d, p, t, ɑ, ʌ}",adapt,verb,55,unknown,Legally take (another's child) and bring it up as one's own,They adopted a child.
adult,ʌ d ʌ l t,AH0 D AH1 L T,"{d, l, t, ʌ}",adalt,"noun, adjective",56,unknown,A person who is fully grown or developed,She is an adult.
advance,ʌ d v æ n s,AH0 D V AE1 N S,"{d, n, s, v, æ, ʌ}",adwens,"verb, noun, adjective",57,unknown,"Move forward, typically in a purposeful way",They advanced towards the goal.
advanced,ʌ d v æ n s t,AH0 D V AE1 N S T,"{d, n, s, t, v, æ, ʌ}",adwenst,adjective,58,unknown,Far on or ahead in development or progress,She is in an advanced class.
advantage,æ d v æ n t ɪ dʒ,AE0 D V AE1 N T IH0 JH,"{d, dʒ, n, t, v, æ, ɪ}",edwentydż,"noun, verb",59,unknown,A condition or circumstance that puts one in a favorable or superior position,She has an advantage in the competition.
adventure,æ d v ɛ n tʃ ɝ,AE0 D V EH1 N CH ER0,"{d, n, tʃ, v, æ, ɛ, ɝ}",edwenćer,"noun, verb",60,unknown,"An unusual and exciting, typically hazardous, experience or activity",They went on an adventure.
advert,æ d v ɝ t,AE1 D V ER0 T,"{d, t, v, æ, ɝ}",edwert,"noun, verb",61,unknown,"A notice or announcement in a public medium promoting a product, service, or event",She saw an advert for a new car.
advertise,æ d v ɝ t aɪ z,AE1 D V ER0 T AY2 Z,"{aɪ, d, t, v, z, æ, ɝ}",edwertajz,verb,62,unknown,"Describe or draw attention to (a product, service, or event) in a public medium to promote sales or attendance",They advertised the event on TV.
advertisement,æ d v ɝ t ʌ z m ʌ n t,AE0 D V ER1 T AH0 Z M AH0 N T,"{d, m, n, t, v, z, æ, ɝ, ʌ}",edwertazmant,noun,63,unknown,"A notice or announcement in a public medium promoting a product, service, or event",The advertisement was very effective.
advertising,æ d v ɝ t aɪ z ɪ ŋ,AE1 D V ER0 T AY2 Z IH0 NG,"{aɪ, d, t, v, z, æ, ŋ, ɝ, ɪ}",edwertajzyŋ,noun,64,unknown,The activity or profession of producing advertisements for commercial products or services,She works in advertising.
advice,æ d v aɪ s,AE0 D V AY1 S,"{aɪ, d, s, v, æ}",edwajs,noun,65,unknown,Guidance or recommendations offered with regard to prudent future action,She gave good advice.
advise,æ d v aɪ z,AE0 D V AY1 Z,"{aɪ, d, v, z, æ}",edwajz,verb,66,unknown,Offer suggestions about the best course of action to someone,She advised him to rest.
affair,ʌ f ɛ r,AH0 F EH1 R,"{f, r, ɛ, ʌ}",afer,noun,67,unknown,An event or sequence of events of a specified kind or that has previously been referred to,It was a private affair.
affect,ʌ f ɛ k t,AH0 F EH1 K T,"{f, k, t, ɛ, ʌ}",afekt,verb,68,unknown,Have an effect on; make a difference to,The weather affects my mood.
affection,ʌ f ɛ k ʃ ʌ n,AH0 F EH1 K SH AH0 N,"{f, k, n, ɛ, ʃ, ʌ}",afekśan,noun,69,unknown,A gentle feeling of fondness or liking,She has deep affection for her pet.
afford,ʌ f ɔ r d,AH0 F AO1 R D,"{d, f, r, ɔ, ʌ}",aford,verb,70,unknown,Have enough money to pay for,They can't afford a new car.
afraid,ʌ f r eɪ d,AH0 F R EY1 D,"{d, eɪ, f, r, ʌ}",afrejd,adjective,71,unknown,Feeling fear or anxiety; frightened,She is afraid of spiders.
after,æ f t ɝ,AE1 F T ER0,"{f, t, æ, ɝ}",efter,"preposition, conjunction, adverb",72,unknown,In the time following (an event or another period of time),We can discuss this after lunch.
afternoon,æ f t ɝ n u n,AE2 F T ER0 N UW1 N,"{f, n, t, u, æ, ɝ}",efternun,noun,73,unknown,The time from noon or lunchtime to evening,They met in the afternoon.
afterwards,æ f t ɝ w ɝ d z,AE1 F T ER0 W ER0 D Z,"{d, f, t, w, z, æ, ɝ}",efterłerdz,adverb,74,unknown,At a later or future time,"She went shopping and afterwards, she relaxed."
again,ʌ g ɛ n,AH0 G EH1 N,"{g, n, ɛ, ʌ}",agen,adverb,75,unknown,Another time; once more,She sang the song again.
against,ʌ g ɛ n s t,AH0 G EH1 N S T,"{g, n, s, t, ɛ, ʌ}",agenst,preposition,76,unknown,In opposition to,She stood against the wall.
age,eɪ dʒ,EY1 JH,"{dʒ, eɪ}",ejdż,noun,77,unknown,The length of time that a person has lived or a thing has existed,She is 30 years of age.
aged,eɪ dʒ d,EY1 JH D,"{d, dʒ, eɪ}",ejdżd,adjective,78,unknown,Having lived for a specified length of time; old,The aged man walked slowly.
agency,eɪ dʒ ʌ n s i,EY1 JH AH0 N S IY0,"{dʒ, eɪ, i, n, s, ʌ}",ejdżansi,noun,79,unknown,A business or organization providing a particular service,She works at an advertising agency.
agent,eɪ dʒ ʌ n t,EY1 JH AH0 N T,"{dʒ, eɪ, n, t, ʌ}",ejdżant,noun,80,unknown,A person who acts on behalf of another person or group,He is a secret agent.
aggressive,ʌ g r ɛ s ɪ v,AH0 G R EH1 S IH0 V,"{g, r, s, v, ɛ, ɪ, ʌ}",agresyw,adjective,81,unknown,Ready or likely to attack or confront; characterized by or resulting from aggression,He was aggressive during the argument.
ago,ʌ g oʊ,AH0 G OW1,"{g, oʊ, ʌ}",agoł,adverb,82,unknown,Before the present; earlier,It happened a long time ago.
agree,ʌ g r i,AH0 G R IY1,"{g, i, r, ʌ}",agri,verb,83,unknown,Have the same opinion about something; concur,I agree with your opinion.
agreement,ʌ g r i m ʌ n t,AH0 G R IY1 M AH0 N T,"{g, i, m, n, r, t, ʌ}",agrimant,noun,84,unknown,A negotiated and typically legally binding arrangement between parties,They signed the agreement.
ahead,ʌ h ɛ d,AH0 HH EH1 D,"{d, h, ɛ, ʌ}",ahed,adverb,85,unknown,In or toward the front; in advance,She looked ahead and saw the finish line.
aid,eɪ d,EY1 D,"{d, eɪ}",ejd,"noun, verb",86,unknown,"Help, typically of a practical nature",They provided aid to the refugees.
aim,eɪ m,EY1 M,"{eɪ, m}",ejm,"verb, noun",87,unknown,Point or direct (a weapon or camera) at a target,He aimed at the target.
air,ɛ r,EH1 R,"{r, ɛ}",er,noun,88,unknown,"The invisible gaseous substance surrounding the earth, a mixture mainly of oxygen and nitrogen",The air is fresh in the mountains.
aircraft,ɛ r k r æ f t,EH1 R K R AE2 F T,"{f, k, r, t, æ, ɛ}",erkreft,noun,89,unknown,A vehicle that is able to fly by gaining support from the air,The aircraft took off smoothly.
airport,ɛ r p ɔ r t,EH1 R P AO2 R T,"{p, r, t, ɔ, ɛ}",erport,noun,90,unknown,"A complex of runways and buildings for the takeoff, landing, and maintenance of civil aircraft",She waited at the airport.
alarm,ʌ l ɑ r m,AH0 L AA1 R M,"{l, m, r, ɑ, ʌ}",alarm,"noun, verb",91,unknown,An anxious awareness of danger,She felt a sense of alarm.
alarmed,ʌ l ɑ r m d,AH0 L AA1 R M D,"{d, l, m, r, ɑ, ʌ}",alarmd,adjective,92,unknown,Experiencing a sudden sense of danger,He was alarmed by the news.
alarming,ʌ l ɑ r m ɪ ŋ,AH0 L AA1 R M IH0 NG,"{l, m, r, ŋ, ɑ, ɪ, ʌ}",alarmyŋ,adjective,93,unknown,Worrying or disturbing,The situation is alarming.
alcohol,æ l k ʌ h ɑ l,AE1 L K AH0 HH AA2 L,"{h, k, l, æ, ɑ, ʌ}",elkahal,noun,94,unknown,"A colorless volatile flammable liquid which is the intoxicating constituent of wine, beer, spirits, and other drinks",He doesn't drink alcohol.
alcoholic,æ l k ʌ h ɑ l ɪ k,AE2 L K AH0 HH AA1 L IH0 K,"{h, k, l, æ, ɑ, ɪ, ʌ}",elkahalyk,"adjective, noun",95,unknown,Containing or relating to alcoholic liquor,He is an alcoholic.
alive,ʌ l aɪ v,AH0 L AY1 V,"{aɪ, l, v, ʌ}",alajw,adjective,96,unknown,"Living, not dead",The patient is still alive.
all,ɔ l,AO1 L,"{l, ɔ}",ol,"determiner, pronoun, adverb",97,unknown,Used to refer to the whole quantity or extent of a particular group or thing,All the students passed the exam.
allied,ʌ l aɪ d,AH0 L AY1 D,"{aɪ, d, l, ʌ}",alajd,adjective,98,unknown,Joined by or relating to members of an alliance,The allied forces launched an attack.
allow,ʌ l aʊ,AH0 L AW1,"{aʊ, l, ʌ}",alau,verb,99,unknown,Give (someone) permission to do something,She allowed him to leave.
ally,æ l aɪ,AE1 L AY0,"{aɪ, l, æ}",elaj,noun,100,unknown,A state formally cooperating with another for a military or other purpose,The country is an ally of the US.
almost,ɔ l m oʊ s t,AO1 L M OW2 S T,"{l, m, oʊ, s, t, ɔ}",olmołst,adverb,101,unknown,Very nearly but not exactly or entirely,She almost missed the bus.
alone,ʌ l oʊ n,AH0 L OW1 N,"{l, n, oʊ, ʌ}",alołn,"adjective, adverb",102,unknown,Having no one else present; on one's own,He lives alone.
along,ʌ l ɔ ŋ,AH0 L AO1 NG,"{l, ŋ, ɔ, ʌ}",aloŋ,"preposition, adverb",103,unknown,Moving in a constant direction on (a path or any more or less horizontal surface),They walked along the beach.
alongside,ʌ l ɔ ŋ s aɪ d,AH0 L AO1 NG S AY1 D,"{aɪ, d, l, s, ŋ, ɔ, ʌ}",aloŋsajd,"preposition, adverb",104,unknown,Close to the side of; next to,The boat was docked alongside the pier.
aloud,ʌ l aʊ d,AH0 L AW1 D,"{aʊ, d, l, ʌ}",alaud,adverb,105,unknown,Audibly; not silently or in a whisper,She read the letter aloud.
alphabet,æ l f ʌ b ɛ t,AE1 L F AH0 B EH2 T,"{b, f, l, t, æ, ɛ, ʌ}",elfabet,noun,106,unknown,A set of letters or symbols in a fixed order used for writing a language,The English alphabet has 26 letters.
alphabetical,æ l f ʌ b ɛ t ɪ k ʌ l,AE2 L F AH0 B EH1 T IH0 K AH0 L,"{b, f, k, l, t, æ, ɛ, ɪ, ʌ}",elfabetykal,adjective,107,unknown,Arranged in the order of the letters of the alphabet,The books are in alphabetical order.
alphabetically,æ l f ʌ b ɛ t ɪ k l i,AE2 L F AH0 B EH1 T IH0 K L IY0,"{b, f, i, k, l, t, æ, ɛ, ɪ, ʌ}",elfabetykli,adverb,108,unknown,In alphabetical order,The files are sorted alphabetically.
already,ɔ l r ɛ d i,AO0 L R EH1 D IY0,"{d, i, l, r, ɔ, ɛ}",olredi,adverb,109,unknown,Before or by now or the time in question,She has already finished her homework.
also,ɔ l s oʊ,AO1 L S OW0,"{l, oʊ, s, ɔ}",olsoł,adverb,110,unknown,In addition; too,She is talented and also very hardworking.
alter,ɔ l t ɝ,AO1 L T ER0,"{l, t, ɔ, ɝ}",olter,verb,111,unknown,Change or cause to change in character or composition,He altered his appearance.
alternative,ɔ l t ɝ n ʌ t ɪ v,AO0 L T ER1 N AH0 T IH0 V,"{l, n, t, v, ɔ, ɝ, ɪ, ʌ}",olternatyw,"noun, adjective",112,unknown,Available as another possibility or choice,There is an alternative route.
alternatively,ɔ l t ɝ n ʌ t ɪ v l i,AO0 L T ER1 N AH0 T IH0 V L IY0,"{i, l, n, t, v, ɔ, ɝ, ɪ, ʌ}",olternatywli,adverb,113,unknown,As another option or possibility,You could alternatively use a different tool.
although,ɔ l ð oʊ,AO2 L DH OW1,"{l, oʊ, ð, ɔ}",olðoł,conjunction,114,unknown,In spite of the fact that; even though,"Although it was raining, we went for a walk."
altogether,ɔ l t ʌ g ɛ ð ɝ,AO2 L T AH0 G EH1 DH ER0,"{g, l, t, ð, ɔ, ɛ, ɝ, ʌ}",oltageðer,adverb,115,unknown,Completely; totally,She stopped seeing him altogether.
always,ɔ l w eɪ z,AO1 L W EY2 Z,"{eɪ, l, w, z, ɔ}",olłejz,adverb,116,unknown,At all times; on all occasions,She always arrives on time.
a.m.,eɪ ɛ m,EY2 EH1 M,"{eɪ, m, ɛ}",ejem,abbreviation,117,unknown,Before noon,The meeting is at 10 a.m.
amaze,ʌ m eɪ z,AH0 M EY1 Z,"{eɪ, m, z, ʌ}",amejz,verb,118,unknown,Surprise (someone) greatly; fill with astonishment,The performance amazed everyone.
amazed,ʌ m eɪ z d,AH0 M EY1 Z D,"{d, eɪ, m, z, ʌ}",amejzd,adjective,119,unknown,Greatly surprised; astonished,She was amazed by the news.
amazing,ʌ m eɪ z ɪ ŋ,AH0 M EY1 Z IH0 NG,"{eɪ, m, z, ŋ, ɪ, ʌ}",amejzyŋ,adjective,120,unknown,Causing great surprise or wonder; astonishing,The view is amazing.
ambition,æ m b ɪ ʃ ʌ n,AE0 M B IH1 SH AH0 N,"{b, m, n, æ, ɪ, ʃ, ʌ}",embyśan,noun,121,unknown,A strong desire to do or achieve something,His ambition is to become a doctor.
ambulance,æ m b j ʌ l ʌ n s,AE1 M B Y AH0 L AH0 N S,"{b, j, l, m, n, s, æ, ʌ}",embjalans,noun,122,unknown,A vehicle specially equipped for taking sick or injured people to and from the hospital,The ambulance arrived quickly.
among,ʌ m ʌ ŋ,AH0 M AH1 NG,"{m, ŋ, ʌ}",amaŋ,preposition,123,unknown,Situated more or less centrally in relation to (several other things),There was a big tree among the houses.
amount,ʌ m aʊ n t,AH0 M AW1 N T,"{aʊ, m, n, t, ʌ}",amaunt,noun,124,unknown,A quantity of something,The amount of water needed is 2 liters.
amuse,ʌ m j u z,AH0 M Y UW1 Z,"{j, m, u, z, ʌ}",amjuz,verb,125,unknown,Cause (someone) to find something funny; entertain,The clown amused the children.
amused,ʌ m j u z d,AH0 M Y UW1 Z D,"{d, j, m, u, z, ʌ}",amjuzd,adjective,126,unknown,Finding something funny or entertaining,She was amused by his jokes.
amusing,ʌ m j u z ɪ ŋ,AH0 M Y UW1 Z IH0 NG,"{j, m, u, z, ŋ, ɪ, ʌ}",amjuzyŋ,adjective,127,unknown,Causing laughter or providing entertainment,The movie was very amusing.
analysis,ʌ n æ l ʌ s ʌ s,AH0 N AE1 L AH0 S AH0 S,"{l, n, s, æ, ʌ}",anelasas,noun,128,unknown,Detailed examination of the elements or structure of something,The analysis revealed some interesting facts.
ancient,eɪ n tʃ ʌ n t,EY1 N CH AH0 N T,"{eɪ, n, t, tʃ, ʌ}",ejnćant,adjective,129,unknown,Belonging to the very distant past and no longer in existence,They found ancient artifacts.
and,ʌ n d,AH0 N D,"{d, n, ʌ}",and,conjunction,130,unknown,"Used to connect words of the same part of speech, clauses, or sentences",She likes tea and coffee.
anger,æ ŋ g ɝ,AE1 NG G ER0,"{g, æ, ŋ, ɝ}",eŋger,noun,131,unknown,"A strong feeling of annoyance, displeasure, or hostility",He couldn't control his anger.
angle,æ ŋ g ʌ l,AE1 NG G AH0 L,"{g, l, æ, ŋ, ʌ}",eŋgal,noun,132,unknown,The space (usually measured in degrees) between two intersecting lines or surfaces at or close to the point where they meet,The angles of the triangle add up to 180 degrees.
angrily,æ ŋ g r ʌ l i,AE1 NG G R AH0 L IY0,"{g, i, l, r, æ, ŋ, ʌ}",eŋgrali,adverb,133,unknown,In a manner resulting from or betraying anger,She shouted angrily.
angry,æ ŋ g r i,AE1 NG G R IY0,"{g, i, r, æ, ŋ}",eŋgri,adjective,134,unknown,"Feeling or showing strong annoyance, displeasure, or hostility",He was angry about the delay.
animal,æ n ʌ m ʌ l,AE1 N AH0 M AH0 L,"{l, m, n, æ, ʌ}",enamal,noun,135,unknown,"A living organism that feeds on organic matter, typically having specialized sense organs and nervous system and able to respond rapidly to stimuli",The zoo has many animals.
ankle,æ ŋ k ʌ l,AE1 NG K AH0 L,"{k, l, æ, ŋ, ʌ}",eŋkal,noun,136,unknown,The joint connecting the foot with the leg,She twisted her ankle.
anniversary,æ n ʌ v ɝ s ɝ i,AE2 N AH0 V ER1 S ER0 IY0,"{i, n, s, v, æ, ɝ, ʌ}",enawerseri,noun,137,unknown,The date on which an event took place in a previous year,Today is their wedding anniversary.
announce,ʌ n aʊ n s,AH0 N AW1 N S,"{aʊ, n, s, ʌ}",anauns,verb,138,unknown,"Make a public and typically formal declaration about a fact, occurrence, or intention",They announced their engagement.
annoy,ʌ n ɔɪ,AH0 N OY1,"{n, ɔɪ, ʌ}",anoj,verb,139,unknown,Make (someone) a little angry; irritate,His comments annoyed her.
annoyed,ʌ n ɔɪ d,AH0 N OY1 D,"{d, n, ɔɪ, ʌ}",anojd,adjective,140,unknown,Slightly angry; irritated,She was annoyed by the noise.
annoying,ʌ n ɔɪ ɪ ŋ,AH0 N OY1 IH0 NG,"{n, ŋ, ɔɪ, ɪ, ʌ}",anojyŋ,adjective,141,unknown,Causing irritation or annoyance,The loud music was annoying.
annual,æ n j u ʌ l,AE1 N Y UW0 AH0 L,"{j, l, n, u, æ, ʌ}",enjual,adjective,142,unknown,Occurring once every year,The annual meeting is in July.
annually,æ n j u ʌ l i,AE1 N Y UW0 AH0 L IY0,"{i, j, l, n, u, æ, ʌ}",enjuali,adverb,143,unknown,Once a year; every year,The event is held annually.
another,ʌ n ʌ ð ɝ,AH0 N AH1 DH ER0,"{n, ð, ɝ, ʌ}",anaðer,"determiner, pronoun",144,unknown,Used to refer to an additional person or thing of the same type as one already mentioned or known,She needs another pen.
answer,æ n s ɝ,AE1 N S ER0,"{n, s, æ, ɝ}",enser,"noun, verb",145,unknown,"A thing said, written, or done to deal with or as a reaction to a question, statement, or situation",She gave the right answer.
anticipate,æ n t ɪ s ʌ p eɪ t,AE0 N T IH1 S AH0 P EY2 T,"{eɪ, n, p, s, t, æ, ɪ, ʌ}",entysapejt,verb,146,unknown,Regard as probable; expect or predict,They anticipate a lot of rain.
