word,ipa,cmu_pron,phoneme_set,polish_respellings,pos,frequency_rank,level,definition,example_sentence
difficult,d ɪ f ʌ k ʌ l t,D IH1 F AH0 K AH0 L T,"{d, f, k, l, t, ɪ, ʌ}",dyfakalt,"adjective, noun",834,unknown,"Needing much effort or skill to accomplish, deal with, or understand",This is a difficult problem to solve.
difficulty,d ɪ f ʌ k ʌ l t i,D IH1 F AH0 K AH0 L T IY0,"{d, f, i, k, l, t, ɪ, ʌ}",dyfakalti,"noun, verb",835,unknown,The state or condition of being difficult,He had difficulty understanding the instructions.
dig,d ɪ g,D IH1 G,"{d, g, ɪ}",dyg,"verb, noun",836,unknown,"Break up and move earth with a tool or machine, or with hands, paws, snout, etc.",They began to dig a hole.
digital,d ɪ dʒ ʌ t ʌ l,D IH1 JH AH0 T AH0 L,"{d, dʒ, l, t, ɪ, ʌ}",dydżatal,"adjective, noun",837,unknown,Involving or relating to the use of computer technology,She bought a new digital camera.
dinner,d ɪ n ɝ,D IH1 N ER0,"{d, n, ɝ, ɪ}",dyner,"noun, verb",838,unknown,"The main meal of the day, taken either around midday or in the evening",They invited us to dinner.
direct,d ɝ ɛ k t,D ER0 EH1 K T,"{d, k, t, ɛ, ɝ}",derekt,"adjective, verb",839,unknown,Extending or moving from one place to another without changing direction or stopping,He gave me direct instructions.
direction,d ɝ ɛ k ʃ ʌ n,D ER0 EH1 K SH AH0 N,"{d, k, n, ɛ, ɝ, ʃ, ʌ}",derekśan,"noun, verb",840,unknown,A course along which someone or something moves,They headed in the same direction.
directly,d ɝ ɛ k t l i,D ER0 EH1 K T L IY0,"{d, i, k, l, t, ɛ, ɝ}",derektli,adverb,841,unknown,Without changing direction or stopping,She spoke to me directly.
director,d ɝ ɛ k t ɝ,D ER0 EH1 K T ER0,"{d, k, t, ɛ, ɝ}",derekter,"noun, verb",842,unknown,"A person who is in charge of an activity, department, or organization",The film director was praised for his work.
dirt,d ɝ t,D ER1 T,"{d, t, ɝ}",dert,"noun, verb",843,unknown,"A substance, such as soil, that makes something dirty",His shoes were covered in dirt.
dirty,d ɝ t i,D ER1 T IY0,"{d, i, t, ɝ}",derti,"adjective, verb",844,unknown,Covered or marked with an unclean substance,The floor was dirty.
disabled,d ɪ s eɪ b ʌ l d,D IH0 S EY1 B AH0 L D,"{b, d, eɪ, l, s, ɪ, ʌ}",dysejbald,"adjective, noun",845,unknown,"Having a physical or mental condition that limits movements, senses, or activities",The building is accessible for disabled people.
disadvantage,d ɪ s ʌ d v æ n t ɪ dʒ,D IH2 S AH0 D V AE1 N T IH0 JH,"{d, dʒ, n, s, t, v, æ, ɪ, ʌ}",dysadwentydż,"noun, verb",846,unknown,An unfavorable circumstance or condition that reduces the chances of success or effectiveness,Being short can be a disadvantage in basketball.
disagree,d ɪ s ʌ g r i,D IH0 S AH0 G R IY1,"{d, g, i, r, s, ɪ, ʌ}",dysagri,"verb, noun",847,unknown,Have or express a different opinion,I disagree with your opinion.
disagreement,d ɪ s ʌ g r i m ʌ n t,D IH0 S AH0 G R IY1 M AH0 N T,"{d, g, i, m, n, r, s, t, ɪ, ʌ}",dysagrimant,"noun, verb",848,unknown,Lack of consensus or approval,They had a disagreement about the project.
disappear,d ɪ s ʌ p ɪ r,D IH2 S AH0 P IH1 R,"{d, p, r, s, ɪ, ʌ}",dysapyr,"verb, noun",849,unknown,Cease to be visible,The sun disappeared behind the clouds.
disappoint,d ɪ s ʌ p ɔɪ n t,D IH2 S AH0 P OY1 N T,"{d, n, p, s, t, ɔɪ, ɪ, ʌ}",dysapojnt,"verb, noun",850,unknown,Fail to fulfill the hopes or expectations of,The movie disappointed many fans.
disappointed,d ɪ s ʌ p ɔɪ n t ɪ d,D IH2 S AH0 P OY1 N T IH0 D,"{d, n, p, s, t, ɔɪ, ɪ, ʌ}",dysapojntyd,"adjective, verb",851,unknown,Sad or displeased because someone or something has failed to fulfill one's hopes or expectations,She was disappointed with the test results.
disappointing,d ɪ s ʌ p ɔɪ n t ɪ ŋ,D IH2 S AH0 P OY1 N T IH0 NG,"{d, n, p, s, t, ŋ, ɔɪ, ɪ, ʌ}",dysapojntyŋ,"adjective, verb",852,unknown,Failing to fulfill someone's hopes or expectations,The game was disappointing.
disappointment,d ɪ s ʌ p ɔɪ n t m ʌ n t,D IH2 S AH0 P OY1 N T M AH0 N T,"{d, m, n, p, s, t, ɔɪ, ɪ, ʌ}",dysapojntmant,"noun, verb",853,unknown,Sadness or displeasure caused by the non-fulfillment of one's hopes or expectations,His failure was a huge disappointment.
disapproval,d ɪ s ʌ p r u v ʌ l,D IH0 S AH0 P R UW1 V AH0 L,"{d, l, p, r, s, u, v, ɪ, ʌ}",dysapruwal,"noun, verb",854,unknown,Possession or expression of an unfavorable opinion,She looked at him with disapproval.
disapprove,d ɪ s ʌ p r u v,D IH2 S AH0 P R UW1 V,"{d, p, r, s, u, v, ɪ, ʌ}",dysapruw,"verb, noun",855,unknown,Have or express an unfavorable opinion about something,They disapprove of smoking.
disapproving,d ɪ s ʌ p r u v ɪ ŋ,D IH0 S AH0 P R UW1 V IH0 NG,"{d, p, r, s, u, v, ŋ, ɪ, ʌ}",dysapruwyŋ,"adjective, verb",856,unknown,Expressing an unfavorable opinion,He gave a disapproving glance.
disaster,d ɪ z æ s t ɝ,D IH0 Z AE1 S T ER0,"{d, s, t, z, æ, ɝ, ɪ}",dyzester,"noun, verb",857,unknown,"A sudden event, such as an accident or a natural catastrophe, that causes great damage or loss of life",The earthquake was a disaster.
disc,d ɪ s k,D IH1 S K,"{d, k, s, ɪ}",dysk,"noun, verb",858,unknown,"A flat, thin, round object",She inserted the disc into the computer.
discipline,d ɪ s ʌ p l ʌ n,D IH1 S AH0 P L AH0 N,"{d, l, n, p, s, ɪ, ʌ}",dysaplan,"noun, verb",859,unknown,"The practice of training people to obey rules or a code of behavior, using punishment to correct disobedience",The school enforces strict discipline.
discount,d ɪ s k aʊ n t,D IH0 S K AW1 N T,"{aʊ, d, k, n, s, t, ɪ}",dyskaunt,"noun, verb",860,unknown,A deduction from the usual cost of something,The store offers a discount on all items.
discover,d ɪ s k ʌ v ɝ,D IH0 S K AH1 V ER0,"{d, k, s, v, ɝ, ɪ, ʌ}",dyskawer,"verb, noun",861,unknown,Find (something or someone) unexpectedly or in the course of a search,She discovered a hidden talent for painting.
discovery,d ɪ s k ʌ v ɝ i,D IH0 S K AH1 V ER0 IY0,"{d, i, k, s, v, ɝ, ɪ, ʌ}",dyskaweri,"noun, verb",862,unknown,The action or process of discovering or being discovered,The discovery of the new element was groundbreaking.
discuss,d ɪ s k ʌ s,D IH0 S K AH1 S,"{d, k, s, ɪ, ʌ}",dyskas,"verb, noun",863,unknown,Talk about (something) with another person or group of people,They discussed the plan in detail.
discussion,d ɪ s k ʌ ʃ ʌ n,D IH0 S K AH1 SH AH0 N,"{d, k, n, s, ɪ, ʃ, ʌ}",dyskaśan,"noun, verb",864,unknown,The action or process of talking about something,The discussion lasted for hours.
disease,d ɪ z i z,D IH0 Z IY1 Z,"{d, i, z, ɪ}",dyziz,"noun, verb",865,unknown,"A disorder of structure or function in a human, animal, or plant, especially one that produces specific signs or symptoms or that affects a specific location and is not simply a direct result of physical injury",He suffers from a rare disease.
disgust,d ɪ s g ʌ s t,D IH0 S G AH1 S T,"{d, g, s, t, ɪ, ʌ}",dysgast,"noun, verb",866,unknown,A feeling of revulsion or strong disapproval aroused by something unpleasant or offensive,She looked at the trash with disgust.
disgusted,d ɪ s g ʌ s t ʌ d,D IH0 S G AH1 S T AH0 D,"{d, g, s, t, ɪ, ʌ}",dysgastad,"adjective, verb",867,unknown,Feeling or expressing revulsion or strong disapproval,He was disgusted by the smell.
disgusting,d ɪ s g ʌ s t ɪ ŋ,D IH0 S G AH1 S T IH0 NG,"{d, g, s, t, ŋ, ɪ, ʌ}",dysgastyŋ,"adjective, verb",868,unknown,Arousing revulsion or strong indignation,The food was disgusting.
dish,d ɪ ʃ,D IH1 SH,"{d, ɪ, ʃ}",dyś,"noun, verb",869,unknown,"A shallow, typically flat-bottomed container for cooking or serving food",She served the pasta in a large dish.
dishonest,d ɪ s ɑ n ʌ s t,D IH0 S AA1 N AH0 S T,"{d, n, s, t, ɑ, ɪ, ʌ}",dysanast,"adjective, noun",870,unknown,Behaving or prone to behave in an untrustworthy or fraudulent way,He was dishonest about his qualifications.
dishonestly,d ɪ s ɔ n ʌ s t l i,D IH0 S AO1 N AH0 S T L IY0,"{d, i, l, n, s, t, ɔ, ɪ, ʌ}",dysonastli,adverb,871,unknown,"In an untrustworthy, deceitful, or fraudulent manner",She acted dishonestly in the exam.
disk,d ɪ s k,D IH1 S K,"{d, k, s, ɪ}",dysk,"noun, verb",872,unknown,"A flat, thin, round object",She saved the file on a disk.
dislike,d ɪ s l aɪ k,D IH0 S L AY1 K,"{aɪ, d, k, l, s, ɪ}",dyslajk,"verb, noun",873,unknown,Feel distaste for or hostility towards,She dislikes eating broccoli.
dismiss,d ɪ s m ɪ s,D IH0 S M IH1 S,"{d, m, s, ɪ}",dysmys,"verb, noun",874,unknown,Order or allow to leave; send away,The teacher dismissed the class early.
display,d ɪ s p l eɪ,D IH0 S P L EY1,"{d, eɪ, l, p, s, ɪ}",dysplej,"verb, noun",875,unknown,Make a prominent exhibition of (something) in a place where it can be easily seen,They displayed their artwork at the gallery.
dissolve,d ɪ z ɑ l v,D IH0 Z AA1 L V,"{d, l, v, z, ɑ, ɪ}",dyzalw,"verb, noun",876,unknown,With reference to a solid) become or cause to become incorporated into a liquid so as to form a solution,The sugar dissolved in the tea.
distance,d ɪ s t ʌ n s,D IH1 S T AH0 N S,"{d, n, s, t, ɪ, ʌ}",dystans,"noun, verb",877,unknown,An amount of space between two things or people,The distance between the two cities is 200 miles.
distinguish,d ɪ s t ɪ ŋ g w ɪ ʃ,D IH0 S T IH1 NG G W IH0 SH,"{d, g, s, t, w, ŋ, ɪ, ʃ}",dystyŋgłyś,"verb, noun",878,unknown,Recognize or treat (someone or something) as different,He can distinguish between different musical notes.
distribute,d ɪ s t r ɪ b j u t,D IH0 S T R IH1 B Y UW0 T,"{b, d, j, r, s, t, u, ɪ}",dystrybjut,"verb, noun",879,unknown,Give shares of (something); deal out,They distribute food to the homeless.
district,d ɪ s t r ɪ k t,D IH1 S T R IH0 K T,"{d, k, r, s, t, ɪ}",dystrykt,"noun, verb",880,unknown,"An area of a country or city, especially one regarded as a distinct unit because of a particular characteristic",He lives in the financial district.
disturb,d ɪ s t ɝ b,D IH0 S T ER1 B,"{b, d, s, t, ɝ, ɪ}",dysterb,"verb, noun",881,unknown,"Interrupt the quiet, peace, or order of; unsettle",Please do not disturb the meeting.
disturbing,d ɪ s t ɝ b ɪ ŋ,D IH0 S T ER1 B IH0 NG,"{b, d, s, t, ŋ, ɝ, ɪ}",dysterbyŋ,"adjective, verb",882,unknown,Causing anxiety or uneasiness; upsetting,The news was disturbing.
divide,d ɪ v aɪ d,D IH0 V AY1 D,"{aɪ, d, v, ɪ}",dywajd,"verb, noun",883,unknown,Separate or be separated into parts,They decided to divide the profits equally.
division,d ɪ v ɪ ʒ ʌ n,D IH0 V IH1 ZH AH0 N,"{d, n, v, ɪ, ʌ, ʒ}",dywyżan,"noun, verb",884,unknown,"The action of separating something into parts, or the process of being separated",The division of the company into two parts was announced.
divorce,d ɪ v ɔ r s,D IH0 V AO1 R S,"{d, r, s, v, ɔ, ɪ}",dywors,"noun, verb",885,unknown,The legal dissolution of a marriage by a court or other competent body,They finalized their divorce last year.
divorced,d ɪ v ɔ r s t,D IH0 V AO1 R S T,"{d, r, s, t, v, ɔ, ɪ}",dyworst,"adjective, verb",886,unknown,Legally separated from a spouse through divorce,She is divorced and has two children.
do,d u,D UW1,"{d, u}",du,"verb, noun",887,unknown,"Perform (an action, the precise nature of which is often unspecified)",What do you want to do today?
doctor,d ɑ k t ɝ,D AA1 K T ER0,"{d, k, t, ɑ, ɝ}",dakter,"noun, verb",888,unknown,A person who is qualified to treat people who are ill,She visited the doctor for a check-up.
document,d ɑ k j ʌ m ɛ n t,D AA1 K Y AH0 M EH0 N T,"{d, j, k, m, n, t, ɑ, ɛ, ʌ}",dakjament,"noun, verb",889,unknown,"A piece of written, printed, or electronic matter that provides information or evidence or that serves as an official record",He signed the document.
dog,d ɔ g,D AO1 G,"{d, g, ɔ}",dog,"noun, verb",890,unknown,"A domesticated carnivorous mammal that typically has a long snout, an acute sense of smell, non-retractable claws, and a barking, howling, or whining voice",They have a pet dog.
dollar,d ɑ l ɝ,D AA1 L ER0,"{d, l, ɑ, ɝ}",daler,"noun, verb",891,unknown,"The basic monetary unit of the US, Canada, Australia, and certain countries in the Pacific, Caribbean, Southeast Asia, Africa, and South America",The item costs ten dollars.
domestic,d ʌ m ɛ s t ɪ k,D AH0 M EH1 S T IH0 K,"{d, k, m, s, t, ɛ, ɪ, ʌ}",damestyk,"adjective, noun",892,unknown,Relating to the running of a home or to family relations,She is a domestic worker.
dominate,d ɑ m ʌ n eɪ t,D AA1 M AH0 N EY2 T,"{d, eɪ, m, n, t, ɑ, ʌ}",damanejt,"verb, noun",893,unknown,Have a commanding influence on; exercise control over,One company has dominated the market.
door,d ɔ r,D AO1 R,"{d, r, ɔ}",dor,"noun, verb",894,unknown,"A hinged, sliding, or revolving barrier at the entrance to a building, room, or vehicle",He knocked on the door.
dot,d ɑ t,D AA1 T,"{d, t, ɑ}",dat,"noun, verb",895,unknown,A small round mark or spot,She put a dot at the end of the sentence.
double,d ʌ b ʌ l,D AH1 B AH0 L,"{b, d, l, ʌ}",dabal,"adjective, noun",896,unknown,"Consisting of two equal, identical, or similar parts or things",They ordered a double room.
doubt,d aʊ t,D AW1 T,"{aʊ, d, t}",daut,"noun, verb",897,unknown,A feeling of uncertainty or lack of conviction,He had doubts about the plan.
down,d aʊ n,D AW1 N,"{aʊ, d, n}",daun,"adverb, adjective",898,unknown,Towards or in a lower place or position,The sun went down.
downstairs,d aʊ n s t ɛ r z,D AW1 N S T EH1 R Z,"{aʊ, d, n, r, s, t, z, ɛ}",daunsterz,"adverb, adjective",899,unknown,Situated downstairs,The kitchen is downstairs.
downward,d aʊ n w ɝ d,D AW1 N W ER0 D,"{aʊ, d, n, w, ɝ}",daunłerd,"adjective, noun",900,unknown,Moving or leading towards a lower place or level,The stock market took a downward turn.
downwards,d aʊ n w ɝ d z,D AW1 N W ER0 D Z,"{aʊ, d, n, w, z, ɝ}",daunłerdz,adverb,901,unknown,"Toward a lower place, point, or level",She looked downwards at her feet.
dozen,d ʌ z ʌ n,D AH1 Z AH0 N,"{d, n, z, ʌ}",dazan,"noun, adjective",902,unknown,A group or set of twelve,He bought a dozen eggs.
draft,d r æ f t,D R AE1 F T,"{d, f, r, t, æ}",dreft,"noun, verb",903,unknown,A preliminary version of a piece of writing,She wrote a draft of the report.
drag,d r æ g,D R AE1 G,"{d, g, r, æ}",dreg,"verb, noun",904,unknown,"Pull (someone or something) along forcefully, roughly, or with difficulty",He had to drag the heavy box.
drama,d r ɑ m ʌ,D R AA1 M AH0,"{d, m, r, ɑ, ʌ}",drama,"noun, verb",905,unknown,"A play for theater, radio, or television",She loves studying drama.
dramatic,d r ʌ m æ t ɪ k,D R AH0 M AE1 T IH0 K,"{d, k, m, r, t, æ, ɪ, ʌ}",drametyk,"adjective, noun",906,unknown,Relating to drama or the performance or study of drama,The movie had a dramatic ending.
dramatically,d r ʌ m æ t ɪ k l i,D R AH0 M AE1 T IH0 K L IY0,"{d, i, k, l, m, r, t, æ, ɪ, ʌ}",drametykli,adverb,907,unknown,In a way that relates to drama or the performance or study of drama,The situation changed dramatically.
draw,d r ɔ,D R AO1,"{d, r, ɔ}",dro,"verb, noun",908,unknown,"Produce (a picture or diagram) by making lines and marks on paper with a pencil, pen, etc.",He can draw very well.
drawer,d r ɔ r,D R AO1 R,"{d, r, ɔ}",dror,"noun, verb",909,unknown,"A boxlike storage compartment without a lid, made to slide horizontally in and out of a desk, chest, or other piece of furniture",She keeps her clothes in a drawer.
dream,d r i m,D R IY1 M,"{d, i, m, r}",drim,"noun, verb",910,unknown,"A series of thoughts, images, and sensations occurring in a person's mind during sleep",She had a strange dream last night.
dress,d r ɛ s,D R EH1 S,"{d, r, s, ɛ}",dres,"verb, noun",911,unknown,Put on one's clothes,He dressed quickly for work.
dressed,d r ɛ s t,D R EH1 S T,"{d, r, s, t, ɛ}",drest,"adjective, verb",912,unknown,Wearing clothes of a specified kind,She was dressed in a beautiful gown.
drink,d r ɪ ŋ k,D R IH1 NG K,"{d, k, r, ŋ, ɪ}",dryŋk,"verb, noun",913,unknown,Take (a liquid) into the mouth and swallow,He drank a glass of water.
drive,d r aɪ v,D R AY1 V,"{aɪ, d, r, v}",drajw,"verb, noun",914,unknown,Operate and control the direction and speed of a motor vehicle,She drives to work every day.
driver,d r aɪ v ɝ,D R AY1 V ER0,"{aɪ, d, r, v, ɝ}",drajwer,"noun, verb",915,unknown,A person who drives a vehicle,The driver waited in the car.
driving,d r aɪ v ɪ ŋ,D R AY1 V IH0 NG,"{aɪ, d, r, v, ŋ, ɪ}",drajwyŋ,"noun, verb",916,unknown,The control and operation of a motor vehicle,He is learning about safe driving.
drop,d r ɑ p,D R AA1 P,"{d, p, r, ɑ}",drap,"verb, noun",917,unknown,Let or make (something) fall vertically,She accidentally dropped her phone.
drug,d r ʌ g,D R AH1 G,"{d, g, r, ʌ}",drag,"noun, verb",918,unknown,A medicine or other substance which has a physiological effect when ingested or otherwise introduced into the body,He was prescribed a new drug.
drugstore,d r ʌ g s t ɔ r,D R AH1 G S T AO2 R,"{d, g, r, s, t, ɔ, ʌ}",dragstor,noun,919,unknown,A pharmacy or a store where medicinal drugs are dispensed and sold,She went to the drugstore to buy some medicine.
drum,d r ʌ m,D R AH1 M,"{d, m, r, ʌ}",dram,"noun, verb",920,unknown,A percussion instrument sounded by being struck with sticks or the hands,He played the drum in the band.
drunk,d r ʌ ŋ k,D R AH1 NG K,"{d, k, r, ŋ, ʌ}",draŋk,"adjective, noun",921,unknown,Affected by alcohol to the extent of losing control of one's faculties or behavior,He was too drunk to drive.
dry,d r aɪ,D R AY1,"{aɪ, d, r}",draj,"adjective, verb",922,unknown,Free from moisture or liquid; not wet or moist,The clothes are dry.
due,d u,D UW1,"{d, u}",du,"adjective, noun",923,unknown,Expected at or planned for at a certain time,The rent is due tomorrow.
dull,d ʌ l,D AH1 L,"{d, l, ʌ}",dal,"adjective, verb",924,unknown,Lacking interest or excitement,The lecture was dull.
dump,d ʌ m p,D AH1 M P,"{d, m, p, ʌ}",damp,"verb, noun",925,unknown,"Deposit or dispose of (garbage, waste, or unwanted material), typically in a careless or hurried way",He dumped the trash in the bin.
during,d ʊ r ɪ ŋ,D UH1 R IH0 NG,"{d, r, ŋ, ɪ, ʊ}",duryŋ,preposition,926,unknown,Throughout the course or duration of (a period of time),He stayed at the hotel during his vacation.
dust,d ʌ s t,D AH1 S T,"{d, s, t, ʌ}",dast,"noun, verb",927,unknown,"Fine, dry particles of matter",She cleaned the dust off the shelves.
duty,d u t i,D UW1 T IY0,"{d, i, t, u}",duti,"noun, verb",928,unknown,A moral or legal obligation; a responsibility,It is your duty to attend the meeting.
dvd,d i v i d i,D IY2 V IY2 D IY1,"{d, i, v}",diwidi,noun,929,unknown,"A type of compact disc able to store large amounts of data, especially high-resolution audiovisual material",They watched a movie on DVD.
dying,d aɪ ɪ ŋ,D AY1 IH0 NG,"{aɪ, d, ŋ, ɪ}",dajyŋ,"adjective, verb",930,unknown,On the point of death,He took care of his dying grandmother.
each,i tʃ,IY1 CH,"{i, tʃ}",ić,"adjective, noun",931,unknown,Every one of two or more people or things considered separately,Each student received a certificate.
ear,i r,IY1 R,"{i, r}",ir,"noun, verb",932,unknown,The organ of hearing and balance in humans and other vertebrates,She has a piercing in her ear.
early,ɝ l i,ER1 L IY0,"{i, l, ɝ}",erli,"adjective, adverb",933,unknown,Happening or done before the usual or expected time,They arrived early to get good seats.
earn,ɝ n,ER1 N,"{n, ɝ}",ern,"verb, noun",934,unknown,Receive (money) in return for labor or services,She earns a good salary.
earth,ɝ θ,ER1 TH,"{ɝ, θ}",erθ,"noun, verb",935,unknown,The planet on which we live; the world,The Earth orbits the sun.
ease,i z,IY1 Z,"{i, z}",iz,"verb, noun",936,unknown,"Make (something unpleasant, painful, or intense) less serious or severe",He tried to ease her pain.
easily,i z ʌ l i,IY1 Z AH0 L IY0,"{i, l, z, ʌ}",izali,adverb,937,unknown,Without difficulty or effort,She solved the problem easily.
east,i s t,IY1 S T,"{i, s, t}",ist,"noun, adjective",938,unknown,The direction towards the point of the horizon where the sun rises,The sun rises in the east.
eastern,i s t ɝ n,IY1 S T ER0 N,"{i, n, s, t, ɝ}",istern,adjective,939,unknown,"Situated in the east, or facing east",They live in the eastern part of the city.
easy,i z i,IY1 Z IY0,"{i, z}",izi,"adjective, noun",940,unknown,Achieved without great effort; presenting few difficulties,The exam was easy.
eat,i t,IY1 T,"{i, t}",it,"verb, noun",941,unknown,Put (food) into the mouth and chew and swallow it,They ate dinner together.
economic,ɛ k ʌ n ɑ m ɪ k,EH2 K AH0 N AA1 M IH0 K,"{k, m, n, ɑ, ɛ, ɪ, ʌ}",ekanamyk,"adjective, noun",942,unknown,Relating to economics or the economy,The country is facing economic challenges.
economy,ɪ k ɑ n ʌ m i,IH0 K AA1 N AH0 M IY0,"{i, k, m, n, ɑ, ɪ, ʌ}",ykanami,"noun, verb",943,unknown,"The wealth and resources of a country or region, especially in terms of the production and consumption of goods and services",The economy is growing.
edge,ɛ dʒ,EH1 JH,"{dʒ, ɛ}",edż,"noun, verb",944,unknown,"The outside limit of an object, area, or surface; a place or part farthest away from the center of something",She stood at the edge of the cliff.
edition,ʌ d ɪ ʃ ʌ n,AH0 D IH1 SH AH0 N,"{d, n, ɪ, ʃ, ʌ}",adyśan,"noun, verb",945,unknown,A particular version or instance of a publication,The second edition of the book was released.
editor,ɛ d ʌ t ɝ,EH1 D AH0 T ER0,"{d, t, ɛ, ɝ, ʌ}",edater,"noun, verb",946,unknown,"A person who is in charge of and determines the final content of a text, particularly a newspaper or magazine",The editor revised the article.
educate,ɛ dʒ ʌ k eɪ t,EH1 JH AH0 K EY2 T,"{dʒ, eɪ, k, t, ɛ, ʌ}",edżakejt,"verb, noun",947,unknown,"Give intellectual, moral, and social instruction to (someone), typically at a school or university",Teachers educate students.
educated,ɛ dʒ ʌ k eɪ t ɪ d,EH1 JH AH0 K EY2 T IH0 D,"{d, dʒ, eɪ, k, t, ɛ, ɪ, ʌ}",edżakejtyd,"adjective, verb",948,unknown,Having been educated,She is well educated.
education,ɛ dʒ ʌ k eɪ ʃ ʌ n,EH2 JH AH0 K EY1 SH AH0 N,"{dʒ, eɪ, k, n, ɛ, ʃ, ʌ}",edżakejśan,"noun, verb",949,unknown,"The process of receiving or giving systematic instruction, especially at a school or university",He is studying education at the university.
effect,ɪ f ɛ k t,IH0 F EH1 K T,"{f, k, t, ɛ, ɪ}",yfekt,"noun, verb",950,unknown,A change that is a result or consequence of an action or other cause,The new law had a positive effect.
effective,ɪ f ɛ k t ɪ v,IH0 F EH1 K T IH0 V,"{f, k, t, v, ɛ, ɪ}",yfektyw,"adjective, noun",951,unknown,Successful in producing a desired or intended result,The new method is very effective.
effectively,ɪ f ɛ k t ɪ v l i,IH0 F EH1 K T IH0 V L IY0,"{f, i, k, l, t, v, ɛ, ɪ}",yfektywli,adverb,952,unknown,In such a manner as to achieve a desired result,She worked effectively to meet the deadline.
effort,ɛ f ɝ t,EH1 F ER0 T,"{f, t, ɛ, ɝ}",efert,"noun, verb",953,unknown,A vigorous or determined attempt,He put a lot of effort into his work.
egg,ɛ g,EH1 G,"{g, ɛ}",eg,"noun, verb",954,unknown,"An oval or round object laid by a female bird, reptile, fish, or invertebrate, usually containing a developing embryo",She made an omelette with two eggs.
eight,eɪ t,EY1 T,"{eɪ, t}",ejt,numeral,955,unknown,"Equivalent to the product of two and four; one more than seven, or two less than ten",She has eight apples.
eighteen,eɪ t i n,EY0 T IY1 N,"{eɪ, i, n, t}",ejtin,numeral,956,unknown,"Equivalent to the product of two and nine; one more than seventeen, or two less than nineteen",He turned eighteen yesterday.
eighteenth,eɪ t i n θ,EY0 T IY1 N TH,"{eɪ, i, n, t, θ}",ejtinθ,"adjective, noun",957,unknown,Constituting number eighteen in a sequence; 18th,The eighteenth century was a time of change.
eighth,eɪ t θ,EY1 T TH,"{eɪ, t, θ}",ejtθ,"adjective, noun",958,unknown,Constituting number eight in a sequence; 8th,She finished in eighth place.
eightieth,eɪ t i ɪ θ,EY1 T IY0 IH0 TH,"{eɪ, i, t, ɪ, θ}",ejtiyθ,"adjective, noun",959,unknown,Constituting number eighty in a sequence; 80th,He celebrated his eightieth birthday.
eighty,eɪ t i,EY1 T IY0,"{eɪ, i, t}",ejti,numeral,960,unknown,The number equivalent to the product of eight and ten; ten less than ninety; 80,The book costs eighty dollars.
either,i ð ɝ,IY1 DH ER0,"{i, ð, ɝ}",iðer,conjunction,961,unknown,Used before the first of two (or occasionally more) given alternatives (the other being introduced by ‘or’),You can choose either option.
elbow,ɛ l b oʊ,EH1 L B OW2,"{b, l, oʊ, ɛ}",elboł,"noun, verb",962,unknown,The joint between the forearm and the upper arm,He hurt his elbow.
elderly,ɛ l d ɝ l i,EH1 L D ER0 L IY0,"{d, i, l, ɛ, ɝ}",elderli,"adjective, noun",963,unknown,Old or aging,The elderly woman needed assistance.
elect,ɪ l ɛ k t,IH0 L EH1 K T,"{k, l, t, ɛ, ɪ}",ylekt,"verb, noun",964,unknown,Choose (someone) to hold public office or some other position by voting,They elected a new president.
election,ɪ l ɛ k ʃ ʌ n,IH0 L EH1 K SH AH0 N,"{k, l, n, ɛ, ɪ, ʃ, ʌ}",ylekśan,"noun, verb",965,unknown,A formal and organized choice by vote of a person for a political office or other position,The next election will be held in November.
electric,ɪ l ɛ k t r ɪ k,IH0 L EH1 K T R IH0 K,"{k, l, r, t, ɛ, ɪ}",ylektryk,"adjective, noun",966,unknown,"Of, worked by, charged with, or producing electricity",She plugged in the electric kettle.
electrical,ɪ l ɛ k t r ɪ k ʌ l,IH0 L EH1 K T R IH0 K AH0 L,"{k, l, r, t, ɛ, ɪ, ʌ}",ylektrykal,"adjective, noun",967,unknown,Relating to electricity,He is an electrical engineer.
electricity,ɪ l ɛ k t r ɪ s ʌ t i,IH0 L EH2 K T R IH1 S AH0 T IY0,"{i, k, l, r, s, t, ɛ, ɪ, ʌ}",ylektrysati,"noun, verb",968,unknown,A form of energy resulting from the existence of charged particles,The electricity went out during the storm.
