word,ipa,cmu_pron,phoneme_set,polish_respellings,pos,frequency_rank,level,definition,example_sentence
remove,r i m u v,R IY0 M UW1 V,"{i, m, r, u, v}",rimuw,"verb, noun",2320,unknown,Take (something) away or off from the position occupied,Please remove your shoes before entering.
rent,r ɛ n t,R EH1 N T,"{n, r, t, ɛ}",rent,"verb, noun",2321,unknown,"Pay someone for the use of (something, typically property, land, or a car)",They decided to rent an apartment.
rented,r ɛ n t ɪ d,R EH1 N T IH0 D,"{d, n, r, t, ɛ, ɪ}",rentyd,adjective,2322,unknown,Having been leased or let out for a period of time,The rented car was comfortable.
repair,r ɪ p ɛ r,R IH0 P EH1 R,"{p, r, ɛ, ɪ}",ryper,"verb, noun",2323,unknown,Fix or mend (a thing suffering from damage or a fault),He repaired the broken chair.
repeat,r ɪ p i t,R IH0 P IY1 T,"{i, p, r, t, ɪ}",rypit,"verb, noun",2324,unknown,Say again something one has already said,Please repeat what you just said.
repeated,r ɪ p i t ɪ d,R IH0 P IY1 T IH0 D,"{d, i, p, r, t, ɪ}",rypityd,adjective,2325,unknown,Done or occurring again several times in the same way,He made repeated attempts to contact her.
repeatedly,r ɪ p i t ɪ d l i,R IH0 P IY1 T IH0 D L IY0,"{d, i, l, p, r, t, ɪ}",rypitydli,adverb,2326,unknown,Over and over again; constantly,She called repeatedly but got no answer.
replace,r i p l eɪ s,R IY2 P L EY1 S,"{eɪ, i, l, p, r, s}",riplejs,"verb, noun",2327,unknown,Take the place of,She replaced the old battery with a new one.
reply,r ɪ p l aɪ,R IH0 P L AY1,"{aɪ, l, p, r, ɪ}",ryplaj,"verb, noun",2328,unknown,Say something in response to something someone has said,He did not reply to her question.
report,r i p ɔ r t,R IY0 P AO1 R T,"{i, p, r, t, ɔ}",riport,"verb, noun",2329,unknown,"Give a spoken or written account of something that one has observed, heard, done, or investigated",She reported the incident to the police.
reporter,r ɪ p ɔ r t ɝ,R IH0 P AO1 R T ER0,"{p, r, t, ɔ, ɝ, ɪ}",ryporter,"noun, verb",2330,unknown,"A person who reports, especially one employed to report news or conduct interviews for newspapers or broadcasts",The reporter interviewed the mayor.
represent,r ɛ p r ɪ z ɛ n t,R EH2 P R IH0 Z EH1 N T,"{n, p, r, t, z, ɛ, ɪ}",repryzent,"verb, noun",2331,unknown,"Be entitled or appointed to act or speak for (someone), especially in an official capacity",He was chosen to represent his country.
representation,r ɛ p r ʌ z ɛ n t eɪ ʃ ʌ n,R EH2 P R AH0 Z EH0 N T EY1 SH AH0 N,"{eɪ, n, p, r, t, z, ɛ, ʃ, ʌ}",reprazentejśan,"noun, verb",2332,unknown,The action of speaking or acting on behalf of someone or the state of being so represented,The painting is a representation of the artist's feelings.
representative,r ɛ p r ʌ z ɛ n t ʌ t ɪ v,R EH2 P R AH0 Z EH1 N T AH0 T IH0 V,"{n, p, r, t, v, z, ɛ, ɪ, ʌ}",reprazentatyw,"noun, adjective",2333,unknown,A person chosen or appointed to act or speak for another or others,The representative spoke on behalf of the company.
reproduce,r i p r ʌ d u s,R IY2 P R AH0 D UW1 S,"{d, i, p, r, s, u, ʌ}",ripradus,"verb, noun",2334,unknown,Produce again; copy,Scientists can reproduce the results of the experiment.
reputation,r ɛ p j ʌ t eɪ ʃ ʌ n,R EH2 P Y AH0 T EY1 SH AH0 N,"{eɪ, j, n, p, r, t, ɛ, ʃ, ʌ}",repjatejśan,"noun, verb",2335,unknown,The beliefs or opinions that are generally held about someone or something,She has a reputation for being very intelligent.
request,r ɪ k w ɛ s t,R IH0 K W EH1 S T,"{k, r, s, t, w, ɛ, ɪ}",rykłest,"noun, verb",2336,unknown,An act of asking politely or formally for something,She made a request for more information.
require,r i k w aɪ ɝ,R IY2 K W AY1 ER0,"{aɪ, i, k, r, w, ɝ}",rikłajer,"verb, noun",2337,unknown,Need for a particular purpose,This task requires a lot of effort.
requirement,r ɪ k w aɪ r m ʌ n t,R IH0 K W AY1 R M AH0 N T,"{aɪ, k, m, n, r, t, w, ɪ, ʌ}",rykłajrmant,"noun, verb",2338,unknown,A thing that is needed or wanted,Meeting the requirements is essential for the job.
rescue,r ɛ s k j u,R EH1 S K Y UW0,"{j, k, r, s, u, ɛ}",reskju,"verb, noun",2339,unknown,Save (someone) from a dangerous or distressing situation,The lifeguard rescued the swimmer.
research,r i s ɝ tʃ,R IY0 S ER1 CH,"{i, r, s, tʃ, ɝ}",riserć,"noun, verb",2340,unknown,The systematic investigation into and study of materials and sources in order to establish facts and reach new conclusions,She conducted research on climate change.
researcher,r i s ɝ tʃ ɝ,R IY1 S ER0 CH ER0,"{i, r, s, tʃ, ɝ}",riserćer,"noun, verb",2341,unknown,A person who carries out academic or scientific research,The researcher published her findings.
resemble,r ɪ z ɛ m b ʌ l,R IH0 Z EH1 M B AH0 L,"{b, l, m, r, z, ɛ, ɪ, ʌ}",ryzembal,"verb, noun",2342,unknown,"Have qualities or features, especially those of appearance, in common with (someone or something); look or seem like",She resembles her mother.
reservation,r ɛ z ɝ v eɪ ʃ ʌ n,R EH2 Z ER0 V EY1 SH AH0 N,"{eɪ, n, r, v, z, ɛ, ɝ, ʃ, ʌ}",rezerwejśan,"noun, verb",2343,unknown,The action of reserving something,I made a reservation at the restaurant.
resident,r ɛ z ɪ d ʌ n t,R EH1 Z IH0 D AH0 N T,"{d, n, r, t, z, ɛ, ɪ, ʌ}",rezydant,"noun, adjective",2344,unknown,A person who lives somewhere permanently or on a long-term basis,He is a resident of New York.
resist,r ɪ z ɪ s t,R IH0 Z IH1 S T,"{r, s, t, z, ɪ}",ryzyst,"verb, noun",2345,unknown,Withstand the action or effect of,They resisted the temptation to eat junk food.
resistance,r ɪ z ɪ s t ʌ n s,R IH0 Z IH1 S T AH0 N S,"{n, r, s, t, z, ɪ, ʌ}",ryzystans,"noun, verb",2346,unknown,The refusal to accept or comply with something,There was strong resistance to the new law.
resolve,r i z ɑ l v,R IY0 Z AA1 L V,"{i, l, r, v, z, ɑ}",rizalw,"verb, noun",2347,unknown,"Settle or find a solution to (a problem, dispute, or contentious matter)",They resolved their differences.
resort,r ɪ z ɔ r t,R IH0 Z AO1 R T,"{r, t, z, ɔ, ɪ}",ryzort,"noun, verb",2348,unknown,"A place that is a popular destination for vacations or recreation, or which is frequented for a particular purpose",They stayed at a beach resort.
resource,r i s ɔ r s,R IY1 S AO0 R S,"{i, r, s, ɔ}",risors,"noun, verb",2349,unknown,A stock or supply of materials or assets that can be drawn on in order to function effectively,Natural resources are essential for the economy.
respect,r ɪ s p ɛ k t,R IH0 S P EH1 K T,"{k, p, r, s, t, ɛ, ɪ}",ryspekt,"noun, verb",2350,unknown,"A feeling of deep admiration for someone or something elicited by their abilities, qualities, or achievements",He earned the respect of his peers.
respond,r ɪ s p ɑ n d,R IH0 S P AA1 N D,"{d, n, p, r, s, ɑ, ɪ}",ryspand,"verb, noun",2351,unknown,Say something in reply,He responded to her question.
response,r ɪ s p ɑ n s,R IH0 S P AA1 N S,"{n, p, r, s, ɑ, ɪ}",ryspans,"noun, verb",2352,unknown,A verbal or written answer,Her response was quick.
responsibility,r i s p ɑ n s ʌ b ɪ l ʌ t i,R IY0 S P AA2 N S AH0 B IH1 L AH0 T IY0,"{b, i, l, n, p, r, s, t, ɑ, ɪ, ʌ}",rispansabylati,"noun, verb",2353,unknown,The state or fact of having a duty to deal with something or of having control over someone,He has a lot of responsibility at work.
responsible,r i s p ɑ n s ʌ b ʌ l,R IY0 S P AA1 N S AH0 B AH0 L,"{b, i, l, n, p, r, s, ɑ, ʌ}",rispansabal,"adjective, noun",2354,unknown,"Having an obligation to do something, or having control over or care for someone, as part of one's job or role",She is responsible for the project.
rest,r ɛ s t,R EH1 S T,"{r, s, t, ɛ}",rest,"verb, noun",2355,unknown,"Cease work or movement in order to relax, refresh oneself, or recover strength",He needs to rest after the long journey.
restaurant,r ɛ s t ɝ ɑ n t,R EH1 S T ER0 AA2 N T,"{n, r, s, t, ɑ, ɛ, ɝ}",resterant,"noun, verb",2356,unknown,A place where people pay to sit and eat meals that are cooked and served on the premises,They went to a fancy restaurant.
result,r ɪ z ʌ l t,R IH0 Z AH1 L T,"{l, r, t, z, ɪ, ʌ}",ryzalt,"noun, verb",2357,unknown,"A consequence, effect, or outcome of something",The result of the test was positive.
retain,r ɪ t eɪ n,R IH0 T EY1 N,"{eɪ, n, r, t, ɪ}",rytejn,"verb, noun",2358,unknown,Continue to have (something); keep possession of,She retained her composure.
retire,r ɪ t aɪ r,R IH0 T AY1 R,"{aɪ, r, t, ɪ}",rytajr,"verb, noun",2359,unknown,"Leave one's job and cease to work, typically upon reaching the normal age for leaving employment",He plans to retire next year.
return,r ɪ t ɝ n,R IH0 T ER1 N,"{n, r, t, ɝ, ɪ}",rytern,"verb, noun",2360,unknown,Come or go back to a place or person,She returned the book to the library.
reveal,r ɪ v i l,R IH0 V IY1 L,"{i, l, r, v, ɪ}",rywil,"verb, noun",2361,unknown,Make (previously unknown or secret information) known to others,She revealed the truth about the incident.
revenue,r ɛ v ʌ n u,R EH1 V AH0 N UW2,"{n, r, u, v, ɛ, ʌ}",rewanu,"noun, verb",2362,unknown,"Income, especially when of a company or organization and of a substantial nature",The company's revenue has increased.
review,r i v j u,R IY2 V Y UW1,"{i, j, r, u, v}",riwju,"noun, verb",2363,unknown,A formal assessment or examination of something with the possibility or intention of instituting change if necessary,The film received mixed reviews.
revolution,r ɛ v ʌ l u ʃ ʌ n,R EH2 V AH0 L UW1 SH AH0 N,"{l, n, r, u, v, ɛ, ʃ, ʌ}",rewaluśan,"noun, verb",2364,unknown,A forcible overthrow of a government or social order in favor of a new system,The revolution changed the country's history.
reward,r ɪ w ɔ r d,R IH0 W AO1 R D,"{d, r, w, ɔ, ɪ}",ryłord,"noun, verb",2365,unknown,"A thing given in recognition of one's service, effort, or achievement",He received a reward for his hard work.
rhythm,r ɪ ð ʌ m,R IH1 DH AH0 M,"{m, r, ð, ɪ, ʌ}",ryðam,"noun, verb",2366,unknown,"A strong, regular, repeated pattern of movement or sound",The song has a catchy rhythm.
rice,r aɪ s,R AY1 S,"{aɪ, r, s}",rajs,"noun, verb",2367,unknown,"A swamp grass that is widely cultivated as a source of food, especially in Asia",Rice is a staple food in many cultures.
rich,r ɪ tʃ,R IH1 CH,"{r, tʃ, ɪ}",ryć,"adjective, noun",2368,unknown,Having a great deal of money or assets; wealthy,He is a rich businessman.
ride,r aɪ d,R AY1 D,"{aɪ, d, r}",rajd,"verb, noun",2369,unknown,"Sit on and control the movement of (an animal, typically a horse), especially as a recreation or sport",She loves to ride horses.
right,r aɪ t,R AY1 T,"{aɪ, r, t}",rajt,"adjective, noun",2370,unknown,"Morally good, justified, or acceptable",He made the right decision.
ring,r ɪ ŋ,R IH1 NG,"{r, ŋ, ɪ}",ryŋ,"noun, verb",2371,unknown,"A small circular band, typically of precious metal worn on a finger",She wore a gold ring on her finger.
rise,r aɪ z,R AY1 Z,"{aɪ, r, z}",rajz,"verb, noun",2372,unknown,Move from a lower position to a higher one; come or go up,The sun rises in the east.
risk,r ɪ s k,R IH1 S K,"{k, r, s, ɪ}",rysk,"noun, verb",2373,unknown,A situation involving exposure to danger,There is a high risk of injury.
river,r ɪ v ɝ,R IH1 V ER0,"{r, v, ɝ, ɪ}",rywer,"noun, verb",2374,unknown,"A large natural stream of water flowing in a channel to the sea, a lake, or another river",The river flows into the sea.
road,r oʊ d,R OW1 D,"{d, oʊ, r}",rołd,"noun, verb",2375,unknown,"A wide way leading from one place to another, especially one with a specially prepared surface which vehicles can use",They drove down the road.
rock,r ɑ k,R AA1 K,"{k, r, ɑ}",rak,"noun, verb",2376,unknown,"The solid mineral material forming part of the surface of the earth and other similar planets, exposed on the surface or underlying the soil or oceans",He climbed the rock.
role,r oʊ l,R OW1 L,"{l, oʊ, r}",rołl,"noun, verb",2377,unknown,The function assumed or part played by a person or thing in a particular situation,She plays a leading role in the play.
roll,r oʊ l,R OW1 L,"{l, oʊ, r}",rołl,"verb, noun",2378,unknown,Move or cause to move in a particular direction by turning over and over on an axis,He rolled the ball across the field.
romantic,r oʊ m æ n t ɪ k,R OW0 M AE1 N T IH0 K,"{k, m, n, oʊ, r, t, æ, ɪ}",rołmentyk,"adjective, noun",2379,unknown,Conducive to or characterized by the expression of love,They went on a romantic date.
roof,r u f,R UW1 F,"{f, r, u}",ruf,"noun, verb",2380,unknown,The structure forming the upper covering of a building or vehicle,The roof needs repairing.
room,r u m,R UW1 M,"{m, r, u}",rum,"noun, verb",2381,unknown,"A part or division of a building enclosed by walls, floor, and ceiling",The room was spacious and bright.
root,r u t,R UW1 T,"{r, t, u}",rut,"noun, verb",2382,unknown,"The part of a plant which attaches it to the ground or to a support, typically underground, conveying water and nourishment to the rest of the plant via numerous branches and fibers",The tree's roots are deep.
rope,r oʊ p,R OW1 P,"{oʊ, p, r}",rołp,"noun, verb",2383,unknown,A length of strong cord made by twisting together strands of natural fibers such as hemp or artificial fibers such as polypropylene,He tied the package with rope.
rough,r ʌ f,R AH1 F,"{f, r, ʌ}",raf,"adjective, noun",2384,unknown,Having an uneven or irregular surface; not smooth or level,The table had a rough surface.
roughly,r ʌ f l i,R AH1 F L IY0,"{f, i, l, r, ʌ}",rafli,adverb,2385,unknown,In a manner lacking gentleness; harshly or violently,He estimated the cost roughly.
round,r aʊ n d,R AW1 N D,"{aʊ, d, n, r}",raund,"adjective, noun",2386,unknown,Shaped like or approximately like a circle or cylinder,The table was round.
route,r u t,R UW1 T,"{r, t, u}",rut,"noun, verb",2387,unknown,A way or course taken in getting from a starting point to a destination,They took a different route to avoid traffic.
routine,r u t i n,R UW0 T IY1 N,"{i, n, r, t, u}",rutin,"noun, adjective",2388,unknown,A sequence of actions regularly followed; a fixed program,She followed her daily routine.
row,r oʊ,R OW1,"{oʊ, r}",roł,"noun, verb",2389,unknown,A number of people or things in a more or less straight line,They sat in the front row.
royal,r ɔɪ ʌ l,R OY1 AH0 L,"{l, r, ɔɪ, ʌ}",rojal,"adjective, noun",2390,unknown,Having the status of a king or queen or a member of their family,They visited the royal palace.
rub,r ʌ b,R AH1 B,"{b, r, ʌ}",rab,"verb, noun",2391,unknown,Move one's hand or a cloth repeatedly back and forth on the surface of (something) with firm pressure,She rubbed her hands together to warm them up.
rubbish,r ʌ b ɪ ʃ,R AH1 B IH0 SH,"{b, r, ɪ, ʃ, ʌ}",rabyś,"noun, verb",2392,unknown,Waste material; refuse or litter,He threw the rubbish in the bin.
rude,r u d,R UW1 D,"{d, r, u}",rud,"adjective, noun",2393,unknown,Offensively impolite or ill-mannered,His rude comments upset everyone.
ruin,r u ʌ n,R UW1 AH0 N,"{n, r, u, ʌ}",ruan,"verb, noun",2394,unknown,"Reduce (a building or place) to a state of decay, collapse, or disintegration",The ancient city was ruined by the earthquake.
rule,r u l,R UW1 L,"{l, r, u}",rul,"noun, verb",2395,unknown,One of a set of explicit or understood regulations or principles governing conduct within a particular activity or sphere,You must follow the school rules.
ruler,r u l ɝ,R UW1 L ER0,"{l, r, u, ɝ}",ruler,"noun, verb",2396,unknown,A person exercising government or dominion,The ruler of the kingdom was wise and just.
rumor,r u m ɝ,R UW1 M ER0,"{m, r, u, ɝ}",rumer,"noun, verb",2397,unknown,A currently circulating story or report of uncertain or doubtful truth,There is a rumor going around about the new manager.
run,r ʌ n,R AH1 N,"{n, r, ʌ}",ran,"verb, noun",2398,unknown,"Move at a speed faster than a walk, never having both or all the feet on the ground at the same time",She runs every morning to stay fit.
runner,r ʌ n ɝ,R AH1 N ER0,"{n, r, ɝ, ʌ}",raner,"noun, verb",2399,unknown,"A person who runs, especially in a specified way",The runner crossed the finish line.
running,r ʌ n ɪ ŋ,R AH1 N IH0 NG,"{n, r, ŋ, ɪ, ʌ}",ranyŋ,"noun, verb",2400,unknown,The action or movement of a runner,Running is a great way to stay in shape.
rural,r ʊ r ʌ l,R UH1 R AH0 L,"{l, r, ʊ, ʌ}",rural,"adjective, noun",2401,unknown,"In, relating to, or characteristic of the countryside rather than the town",They live in a rural area.
rush,r ʌ ʃ,R AH1 SH,"{r, ʃ, ʌ}",raś,"verb, noun",2402,unknown,Move with urgent haste,She rushed to catch the bus.
sack,s æ k,S AE1 K,"{k, s, æ}",sek,"noun, verb",2403,unknown,"A large bag made of a strong material such as hessian, thick paper, or plastic, used for storing and carrying goods",He carried the potatoes in a sack.
sad,s æ d,S AE1 D,"{d, s, æ}",sed,"adjective, noun",2404,unknown,Feeling or showing sorrow; unhappy,She felt sad after hearing the news.
sadly,s æ d l i,S AE1 D L IY0,"{d, i, l, s, æ}",sedli,adverb,2405,unknown,In a sad manner,He looked at her sadly.
sadness,s æ d n ʌ s,S AE1 D N AH0 S,"{d, n, s, æ, ʌ}",sednas,"noun, verb",2406,unknown,The condition or quality of being sad,Her sadness was obvious.
safe,s eɪ f,S EY1 F,"{eɪ, f, s}",sejf,"adjective, noun",2407,unknown,Protected from or not exposed to danger or risk; not likely to be harmed or lost,The children are safe at home.
safety,s eɪ f t i,S EY1 F T IY0,"{eɪ, f, i, s, t}",sejfti,"noun, verb",2408,unknown,"The condition of being protected from or unlikely to cause danger, risk, or injury",They ensured the safety of the passengers.
sail,s eɪ l,S EY1 L,"{eɪ, l, s}",sejl,"verb, noun",2409,unknown,"Travel in a boat with sails, especially as a sport or recreation",They decided to sail around the world.
sailing,s eɪ l ɪ ŋ,S EY1 L IH0 NG,"{eɪ, l, s, ŋ, ɪ}",sejlyŋ,"noun, verb",2410,unknown,The action of sailing in a boat,Sailing is his favorite hobby.
salary,s æ l ɝ i,S AE1 L ER0 IY0,"{i, l, s, æ, ɝ}",seleri,"noun, verb",2411,unknown,"A fixed regular payment, typically paid on a monthly or biweekly basis but often expressed as an annual sum, made by an employer to an employee, especially a professional or white-collar worker",She received her salary at the end of the month.
sale,s eɪ l,S EY1 L,"{eɪ, l, s}",sejl,"noun, verb",2412,unknown,The exchange of a commodity for money; the action of selling something,The sale of the house was completed.
salt,s ɔ l t,S AO1 L T,"{l, s, t, ɔ}",solt,"noun, verb",2413,unknown,A white crystalline substance which gives seawater its characteristic taste and is used for seasoning or preserving food,He added salt to his food.
salty,s ɔ l t i,S AO1 L T IY0,"{i, l, s, t, ɔ}",solti,"adjective, noun",2414,unknown,"Tasting of, containing, or preserved with salt",The soup was too salty.
same,s eɪ m,S EY1 M,"{eɪ, m, s}",sejm,"adjective, noun",2415,unknown,Identical; not different,They wore the same dress.
sample,s æ m p ʌ l,S AE1 M P AH0 L,"{l, m, p, s, æ, ʌ}",sempal,"noun, verb",2416,unknown,A small part or quantity intended to show what the whole is like,He took a sample of the soil.
sand,s æ n d,S AE1 N D,"{d, n, s, æ}",send,"noun, verb",2417,unknown,"A loose granular substance, typically pale yellowish brown, resulting from the erosion of siliceous and other rocks and forming a major constituent of beaches, riverbeds, the seabed, and deserts",The children played in the sand.
satisfaction,s æ t ʌ s f æ k ʃ ʌ n,S AE2 T AH0 S F AE1 K SH AH0 N,"{f, k, n, s, t, æ, ʃ, ʌ}",setasfekśan,"noun, verb",2418,unknown,"Fulfillment of one's wishes, expectations, or needs, or the pleasure derived from this",He felt a sense of satisfaction after finishing the job.
satisfied,s æ t ʌ s f aɪ d,S AE1 T AH0 S F AY2 D,"{aɪ, d, f, s, t, æ, ʌ}",setasfajd,"adjective, verb",2419,unknown,Contented; pleased,She was satisfied with the service.
satisfy,s æ t ʌ s f aɪ,S AE1 T AH0 S F AY2,"{aɪ, f, s, t, æ, ʌ}",setasfaj,"verb, noun",2420,unknown,"Meet the expectations, needs, or desires of (someone)",The food satisfied their hunger.
sauce,s ɔ s,S AO1 S,"{s, ɔ}",sos,"noun, verb",2421,unknown,A liquid or semi-liquid substance served with food to add moistness and flavor,She added sauce to the pasta.
save,s eɪ v,S EY1 V,"{eɪ, s, v}",sejw,"verb, noun",2422,unknown,Keep safe or rescue (someone or something) from harm or danger,They worked hard to save the environment.
saving,s eɪ v ɪ ŋ,S EY1 V IH0 NG,"{eɪ, s, v, ŋ, ɪ}",sejwyŋ,"noun, verb",2423,unknown,"An economy of or reduction in money, time, or another resource",They made a saving by buying in bulk.
say,s eɪ,S EY1,"{eɪ, s}",sej,"verb, noun",2424,unknown,"Utter words so as to convey information, an opinion, a feeling or intention, or an instruction",She didn't know what to say.
scale,s k eɪ l,S K EY1 L,"{eɪ, k, l, s}",skejl,"noun, verb",2425,unknown,An instrument or device used for weighing,He stepped on the scale to weigh himself.
scare,s k ɛ r,S K EH1 R,"{k, r, s, ɛ}",sker,"verb, noun",2426,unknown,Cause great fear or nervousness in; frighten,The loud noise scared the children.
scared,s k ɛ r d,S K EH1 R D,"{d, k, r, s, ɛ}",skerd,"adjective, noun",2427,unknown,Fearful; frightened,She was scared of the dark.
scene,s i n,S IY1 N,"{i, n, s}",sin,"noun, verb",2428,unknown,The place where an incident in real life or fiction occurs or occurred,The crime scene was cordoned off by the police.
schedule,s k ɛ dʒ ʊ l,S K EH1 JH UH0 L,"{dʒ, k, l, s, ɛ, ʊ}",skedżul,"noun, verb",2429,unknown,"A plan for carrying out a process or procedure, giving lists of intended events and times",He followed his daily schedule strictly.
scheme,s k i m,S K IY1 M,"{i, k, m, s}",skim,"noun, verb",2430,unknown,A large-scale systematic plan or arrangement for attaining some particular object or putting a particular idea into effect,They devised a scheme to improve sales.
scary,s k ɛ r i,S K EH1 R IY0,"{i, k, r, s, ɛ}",skeri,"adjective, noun",2431,unknown,Causing fear,The movie was really scary.
science,s aɪ ʌ n s,S AY1 AH0 N S,"{aɪ, n, s, ʌ}",sajans,"noun, verb",2432,unknown,The intellectual and practical activity encompassing the systematic study of the structure and behavior of the physical and natural world through observation and experiment,She is studying environmental science.
scientific,s aɪ ʌ n t ɪ f ɪ k,S AY2 AH0 N T IH1 F IH0 K,"{aɪ, f, k, n, s, t, ɪ, ʌ}",sajantyfyk,"adjective, noun",2433,unknown,Based on or characterized by the methods and principles of science,The research follows scientific methods.
scientist,s aɪ ʌ n t ɪ s t,S AY1 AH0 N T IH0 S T,"{aɪ, n, s, t, ɪ, ʌ}",sajantyst,"noun, verb",2434,unknown,A person who is studying or has expert knowledge of one or more of the natural or physical sciences,The scientist made an important discovery.
scissors,s ɪ z ɝ z,S IH1 Z ER0 Z,"{s, z, ɝ, ɪ}",syzerz,"noun, verb",2435,unknown,"An instrument used for cutting cloth, paper, and other thin material, consisting of two pivoted blades",She cut the paper with scissors.
score,s k ɔ r,S K AO1 R,"{k, r, s, ɔ}",skor,"noun, verb",2436,unknown,"The number of points, goals, runs, etc., achieved in a game or by a team or an individual",The final score was 3-2.
scratch,s k r æ tʃ,S K R AE1 CH,"{k, r, s, tʃ, æ}",skreć,"verb, noun",2437,unknown,"Make a long, narrow superficial wound in the skin or a surface",He scratched his arm on the branch.
scream,s k r i m,S K R IY1 M,"{i, k, m, r, s}",skrim,"verb, noun",2438,unknown,"Give a long, loud, piercing cry or cries expressing excitement, great emotion, or pain",She screamed when she saw the spider.
screen,s k r i n,S K R IY1 N,"{i, k, n, r, s}",skrin,"noun, verb",2439,unknown,"A flat panel or area on an electronic device such as a television, computer, or smartphone, on which images and data are displayed",He watched the movie on a big screen.
screw,s k r u,S K R UW1,"{k, r, s, u}",skru,"noun, verb",2440,unknown,"A metal pin with a spiral thread running around it and a slotted head, used to join things together by being rotated so that it pierces wood, metal, or other material and is held tightly in place",He used a screw to fix the chair.
sea,s i,S IY1,"{i, s}",si,"noun, verb",2441,unknown,The expanse of salt water that covers most of the earth's surface and surrounds its landmasses,They sailed across the sea.
search,s ɝ tʃ,S ER1 CH,"{s, tʃ, ɝ}",serć,"verb, noun",2442,unknown,Try to find something by looking or otherwise seeking carefully and thoroughly,She searched for her keys.
season,s i z ʌ n,S IY1 Z AH0 N,"{i, n, s, z, ʌ}",sizan,"noun, verb",2443,unknown,"Each of the four divisions of the year (spring, summer, autumn, and winter) marked by particular weather patterns and daylight hours, resulting from the earth's changing position with regard to the sun",Spring is her favorite season.
seat,s i t,S IY1 T,"{i, s, t}",sit,"noun, verb",2444,unknown,"A thing made or used for sitting on, such as a chair or stool",He took a seat in the front row.
second,s ɛ k ʌ n d,S EH1 K AH0 N D,"{d, k, n, s, ɛ, ʌ}",sekand,"adjective, noun",2445,unknown,Constituting number two in a sequence; coming after the first in time or order; 2nd,She finished in second place.
secondary,s ɛ k ʌ n d ɛ r i,S EH1 K AH0 N D EH2 R IY0,"{d, i, k, n, r, s, ɛ, ʌ}",sekanderi,"adjective, noun",2446,unknown,"Coming after, less important than, or resulting from someone or something else that is primary",He attended a secondary school.
secret,s i k r ʌ t,S IY1 K R AH0 T,"{i, k, r, s, t, ʌ}",sikrat,"noun, adjective",2447,unknown,Something that is kept or meant to be kept unknown or unseen by others,She revealed her secret.
secretary,s ɛ k r ʌ t ɛ r i,S EH1 K R AH0 T EH2 R IY0,"{i, k, r, s, t, ɛ, ʌ}",sekrateri,"noun, verb",2448,unknown,"A person employed by an individual or in an office to assist with correspondence, keep records, make appointments, and carry out similar tasks",The secretary arranged the meeting.
